,price,address,postcode,number_bedrooms
547,575000.0,Green Lane London SE9,SE9,4.0
548,500000.0,"Hillview Road, Chislehurst, BR7",BR7,2.0
549,415000.0,"Bostall Lane, Abbey Wood, SE2",SE2,3.0
550,750000.0,"Lizban Street, Blackheath, London, SE3",SE3,3.0
551,420000.0,Lakeside Avenue London SE28,SE28,4.0
552,600000.0,"Well Hall Road, London, SE9",SE9,4.0
553,270000.0,"Pippenhall, Southend Crescent, London, SE9",SE9,2.0
554,500000.0,"Ashmore Road, London, SE18",SE18,2.0
555,425000.0,"West Park, London, SE9",SE9,2.0
556,385000.0,Bromhedge London SE9,SE9,3.0
557,580000.0,Lyveden Road London SE3,SE3,2.0
558,499950.0,Federation Road London SE2,SE2,3.0
559,425000.0,"Nadine Street, Charlton, SE7",SE7,2.0
560,395000.0,"Plumbridge Street, London, SE10 8PA",SE10,3.0
561,415000.0,"Jubilee Court, 8 Wood Wharf, Greenwich, London, SE10",SE10,1.0
562,500000.0,"Mell Street, Greenwich, SE10",SE10,2.0
563,460000.0,"Glaisher Street, Greenwich, SE8",SE8,2.0
564,685000.0,"Coleraine Road, Blackheath, London, SE3",SE3,3.0
565,265000.0,"COURTLANDS HOUSE, 202 Court Road, Mottingham, SE9 4UD",SE9,1.0
566,599999.0,"Kidbrooke Way, Kidbrooke, SE3",SE3,3.0
567,450000.0,"Centrum Court, Kidbrooke Village, SE3",SE3,2.0
568,300000.0,Eltham Road Lee SE12,SE12,2.0
569,400000.0,Beaconsfield Close Blackheath SE3,SE3,3.0
571,389995.0,Cyrus Field Street Greenwich SE10,SE10,1.0
572,1250000.0,King George Street London SE10,SE10,3.0
573,500000.0,"Glenesk Road, London, SE9",SE9,3.0
574,464995.0,"The Village Square,
West Parkside,
Greenwich,
London,
SE10 0BD",SE10,1.0
575,250000.0,"Pickwick Court, West Park, London, SE9",SE9,1.0
576,450000.0,"Wallace Court, 54 Tizzard Grove, London, SE3",SE3,2.0
577,117500.0,"Perkins House, London, SE3",SE3,2.0
578,550000.0,"Greenwich South Street, Greenwich, SE10",SE10,2.0
579,775000.0,Tyler Street London SE10,SE10,2.0
580,425000.0,"Travers House, London, SE10",SE10,2.0
583,500000.0,"Burgos Grove, Greenwich, SE10",SE10,2.0
584,357500.0,"Whetstone Road, Kidbrooke, SE3",SE3,2.0
585,705000.0,"Banning Street, London, SE10",SE10,3.0
586,350000.0,"Devonshire Drive, Greenwich, SE10",SE10,1.0
587,625000.0,"Building 36, Marlborough Road, Royal Arsenal SE18",SE18,2.0
588,250000.0,"100 Bloomfield Road, London, SE18",SE18,2.0
589,475000.0,"Kidbrooke Park Road, London, SE3",SE3,2.0
590,330000.0,"Brook Square, Woolwich, SE18",SE18,2.0
591,2850000.0,"Circus Street, London, SE10",SE10,6.0
592,750000.0,"Brand Street, London, SE10",SE10,2.0
593,950000.0,"Prior Street, London, SE10",SE10,2.0
595,460000.0,"Blithdale Road, SE2 * VIDEO & 3D FLOORPLANS AVAILABLE *",SE2,4.0
596,315000.0,"Bexley Road, London, SE9",SE9,2.0
597,295000.0,"Westcombe Park Road, Blackheath, London, SE3",SE3,1.0
598,600000.0,"Reynolds Place, Blackheath, London, SE3",SE3,2.0
599,350000.0,"Hervey Road, Blackheath, London, SE3",SE3,2.0
601,575000.0,"Chichester Lodge, Peartree Way, Greenwich, London, SE10",SE10,2.0
603,940000.0,"No.2, 10 Cutter Lane, Upper Riverside, Greenwich Peninsula SE10",SE10,2.0
604,375000.0,"Queenscroft Road, Eltham SE9",SE9,2.0
605,349995.0,Lyme Farm Road London SE12,SE12,2.0
606,765000.0,"Banning Street,
London,
SE10",SE10,3.0
607,710000.0,"Banning Street,
London,
SE10",SE10,3.0
608,675000.0,"Lambarde Square, London, SE10 9GB",SE10,3.0
609,705000.0,"Banning Street,
London,
SE10",SE10,3.0
610,525000.0,"Old Dover Road, Blackheath, SE3",SE3,3.0
611,675000.0,"Lambarde Square, London, SE10",SE10,3.0
612,590000.0,"Swiftstone Tower, 2 Peartree Way, LONDON, SE10",SE10,2.0
613,880000.0,"Banning Street,
London,
SE10",SE10,3.0
614,599995.0,Bramshot Avenue Charlton SE7,SE7,3.0
615,525000.0,Seren Park Gardens London SE3,SE3,2.0
616,777500.0,"Banning Street,
London,
SE10",SE10,3.0
617,740000.0,"Banning Street,
London,
SE10",SE10,3.0
618,275000.0,"Charlesmere Gardens, Thames Reach, London, SE28",SE28,2.0
619,590000.0,Vanbrugh Hill London SE3,SE3,2.0
620,275000.0,"Hevelius Close, Greenwich, London, SE10",SE10,1.0
621,425000.0,Wellington Gardens London SE7,SE7,2.0
622,399995.0,Ashburnham Place London SE10,SE10,1.0
623,850000.0,"Greenwich Academy, Greenwich, SE10",SE10,3.0
625,143750.0,"Wellington Street,
London,
SE18 6HO",SE18,3.0
626,337500.0,Royal Carriage Mews London SE18,SE18,1.0
628,675000.0,"Lambarde Square, Greenwich, London, SE10",SE10,3.0
629,792500.0,"Banning Street,
London,
SE10",SE10,3.0
630,320000.0,"Sundorne Road, Charlton, SE7",SE7,3.0
631,325000.0,"Eastbrook Road, London, SE3",SE3,2.0
632,299500.0,Ashmore Road London SE18,SE18,1.0
633,575000.0,Glaisher Street London SE8,SE8,2.0
634,500000.0,Eltham Road Lee SE12,SE12,5.0
635,375000.0,Sailacre House Woolwich Road SE10,SE10,1.0
636,750000.0,"Earlswood Street, Greenwich, SE10",SE10,3.0
637,600000.0,"Osier Lane, Off West Parkside, London, SE10",SE10,2.0
638,1600000.0,"Crooms Hill Grove, London, Greater London, SE10",SE10,4.0
640,865000.0,"Hawthorne Crescent, Greenwich, SE10",SE10,4.0
641,610000.0,"East Parkside, Greenwich, London, SE10",SE10,2.0
642,1000000.0,"Balcaskie Road, Eltham SE9",SE9,5.0
643,350000.0,Hartville Road London SE18,SE18,2.0
644,230000.0,"Strongbow Crescent, Eltham, SE9",SE9,2.0
645,805000.0,"Banning Street,
London,
SE10",SE10,3.0
646,380000.0,"209 Charlton Road, London, SE7",SE7,2.0
648,975000.0,Greenwich South Street London SE10,SE10,4.0
649,260000.0,Saunders Road London SE18,SE18,2.0
650,250000.0,"Prince Henry Road, Charlton, London, SE7",SE7,1.0
651,385000.0,Camdale Road London SE18,SE18,3.0
652,450000.0,3 Grove Place Eltham SE9,SE9,2.0
653,750000.0,"Marlborough Lane, London, SE7",SE7,5.0
654,325000.0,"Herbert Road, Plumstead, London, SE18",SE18,2.0
655,360000.0,"Church Manorway, London, SE2",SE2,3.0
656,500000.0,"Bellville House, 79 Norman Road, London, SE10",SE10,2.0
657,550000.0,"Seren Park Gardens, London, SE3",SE3,2.0
659,499999.0,"Parade Ground Path, The Royal Military Academy, Woolwich, SE18",SE18,2.0
660,700000.0,"15 Bessemer Place, Greenwich, London, SE10",SE10,3.0
661,650000.0,"Merlin Court, 31 Tizzard Grove, Kidbrooke Village, London, SE3",SE3,3.0
663,250000.0,Shrewsbury Lane London SE18,SE18,2.0
664,725000.0,"Kidbrooke Park Road, Kidbrooke, SE3",SE3,3.0
665,600000.0,"Hopedale Road, Charlton, SE7",SE7,3.0
666,1375000.0,Guildford Grove Greenwich London SE10,SE10,3.0
667,300000.0,Defence Close London SE28,SE28,2.0
668,420000.0,Cable Walk Greenwich SE10,SE10,1.0
669,375000.0,"Mast Quay, London, SE18",SE18,2.0
670,625000.0,"Thunderer Walk, London, SE18",SE18,2.0
671,320000.0,"Silver Birch Close, London, SE28",SE28,2.0
672,625000.0,Ruthin Road London SE3,SE3,3.0
673,470000.0,Denham Street London SE10,SE10,2.0
674,280000.0,"Oaktree Gardens, New Eltham, SE9",SE9,2.0
675,400000.0,"Peartree Way, London, SE10",SE10,1.0
676,600000.0,Mauritius Road London SE10,SE10,3.0
677,900000.0,Annandale Road Greenwich SE10,SE10,3.0
678,375000.0,"Kelbrook Road, London, SE3",SE3,2.0
679,685000.0,Lindsell Street London SE10,SE10,2.0
680,900000.0,"Ruthin Road, London, SE3",SE3,3.0
681,650000.0,Wellesley Road London SE18,SE18,2.0
682,190000.0,"Whinchat Road, London, SE28",SE28,1.0
683,800000.0,"Tizzard Grove, Kidbrooke, SE3",SE3,4.0
684,575000.0,"Woodlands Heights, Blackheath, London, SE3",SE3,2.0
685,250000.0,"Vanbrugh Park Road West, Blackheath, London, SE3",SE3,0.0
686,190000.0,"Woolf Close, London, SE28",SE28,1.0
689,920000.0,"Upper Riverside, 10 Cutter Lane, Greenwich Peninsula, SE10 0XX",SE10,3.0
691,550000.0,"Blackheath Road, Greenwich, SE10",SE10,2.0
692,585000.0,"Blackheath Road, Greenwich, SE10",SE10,3.0
693,1000000.0,"Blackheath Road, Greenwich, SE10",SE10,5.0
694,655000.0,65 River Gardens Walk Greenwich SE10,SE10,2.0
695,335000.0,Gilbert Close London SE18,SE18,2.0
696,610000.0,"The Moore, 27 East Parkside, Greenwich Peninsula, SE10",SE10,2.0
697,275000.0,Trafalgar Road London SE10,SE10,1.0
698,400000.0,"Blue Building, 115 Woolwich Road, London, SE10",SE10,2.0
699,375000.0,"Holburne Road, London, SE3",SE3,3.0
700,1100000.0,"Westcombe Hill, Blackheath, SE3",SE3,5.0
701,600000.0,"Shooters Hill, Blackheath, London, SE3",SE3,3.0
702,525000.0,"Beanshaw, Mottingham, SE9",SE9,4.0
704,1015000.0,"Royal Arsenal Riverside, 
London, 
SE18
",SE18,3.0
705,502500.0,"Royal Arsenal Riverside, 
London, 
SE18
",SE18,1.0
706,575000.0,"Argyll Road, London, SE18",SE18,2.0
709,500000.0,"Bellville House, London, SE10",SE10,2.0
710,1950000.0,"Elvaston Place, London, SW7",SW7,2.0
712,1900000.0,"Egerton Drive, London, SE10",SE10,4.0
713,225000.0,"Hamlet House, Glenure Road, London, SE9",SE9,1.0
714,500000.0,"Glaisher Street, Greenwich, London, SE8",SE8,2.0
715,525000.0,"Wallace Court, Kidbrooke, London, SE3",SE3,2.0
716,265000.0,"Icough Court, 40 Hassendean Road, Blackheath, London, SE3",SE3,1.0
717,255000.0,Benares Road London SE18,SE18,1.0
718,450000.0,"Blackheath Park, Blackheath, SE3",SE3,2.0
719,750000.0,"Arora Tower, 2 Waterview Drive, Greenwich, SE10",SE10,2.0
720,790000.0,"Upper Riverside, 10 Cutter Lane, Greenwich Peninsula, SE10 0XX",SE10,2.0
721,300000.0,"Deptford High Street, London, SE8",SE8,1.0
722,250000.0,"Hanover House, Orchard Road, London, SE18",SE18,2.0
723,425000.0,"Florence House, Royal Herbert Pavilions, London, SE18",SE18,2.0
724,360000.0,"Whinchat Road, West Thamesmead, London, SE28 0DP",SE28,3.0
725,265000.0,"Elliscombe Road, Charlton, SE7",SE7,1.0
728,725000.0,Catherine Grove London SE10,SE10,3.0
729,625000.0,"Cable Walk, London, London, SE10 0QT",SE10,2.0
730,695000.0,Horseferry Place Greenwich SE10,SE10,2.0
731,520000.0,"Royal Arsenal Riverside, 
London, 
SE18
",SE18,1.0
732,545000.0,"Upper Riverside, 10 Cutter Lane, Greenwich Peninsula, SE10 0XX",SE10,1.0
733,697500.0,"Royal Arsenal Riverside, 
London, 
SE18
",SE18,2.0
734,715000.0,"Royal Arsenal Riverside, 
London, 
SE18
",SE18,2.0
735,832500.0,"Royal Arsenal Riverside, 
London, 
SE18
",SE18,2.0
736,832500.0,"Royal Arsenal Riverside, 
London, 
SE18
",SE18,2.0
737,400000.0,"Blackheath Hill, Greenwich, SE10",SE10,3.0
738,542500.0,"Royal Arsenal Riverside, 
London, 
SE18
",SE18,1.0
739,325000.0,"Langbrook Road, Kidbrooke SE3",SE3,2.0
740,1000000.0,Trafalgar Grove Greenwich SE10,SE10,4.0
741,565000.0,"Brampton Road, Bexleyheath, Kent, DA7",DA7,5.0
742,465000.0,"Upper Riverside, 10 Cutter Lane, Greenwich Peninsula, SE10 0XX",SE10,0.0
744,575000.0,"Warehouse Court, Major Draper Street, London, SE18",SE18,3.0
745,365000.0,"Cardiff Street, Plumstead Common, London, SE18",SE18,2.0
747,315000.0,"40 Blackheath Road, Deptford, SE10",SE10,1.0
749,395000.0,"Chandlers Avenue, Greenwich, London, SE10",SE10,1.0
750,510000.0,"Arora Tower, North Greenwich, SE10",SE10,1.0
751,600000.0,"Wallace Court, 42 Tizzard Grove, Blackheath, London, SE3",SE3,3.0
753,166500.0,"Drummond House, Victory Parade, Royal Arsenal Riverside, Woolwich, London, SE18",SE18,1.0
755,920000.0,"Peartree Way, North Greenwich, London, SE10",SE10,3.0
756,555000.0,"Brumwell Avenue, Woolwich, London, SE18",SE18,3.0
757,585000.0,"Red Lion Lane, London, SE18",SE18,3.0
758,545000.0,"Brumwell Avenue, Woolwich, London, SE18",SE18,3.0
759,225000.0,"Commonwealth Way, SE2 * VIDEO TOUR & 3D FLOORPLANS AVAILABLE *",SE2,2.0
760,600000.0,"Plumstead Common Road, Plumstead, SE18",SE18,3.0
765,745000.0,"Cable Walk, Greenwich, London, SE10",SE10,3.0
766,595000.0,"Metcalfe Court, Teal Street, Greenwich, London, SE10",SE10,3.0
767,499995.0,"Shooters Hill Road, Blackheath, London, SE3",SE3,2.0
769,295000.0,"Casterbridge Road, Blackheath, London, SE3",SE3,1.0
770,799995.0,"Red Lion Lane, Shooters Hill, London, SE18",SE18,4.0
771,325000.0,"Cottrell Court, Southern Way, Greenwich, SE10 0DW",SE10,1.0
772,1100000.0,"Mycenae Road, Blackheath, London, SE3",SE3,3.0
773,500000.0,"Wrottesley Road, London, SE18",SE18,4.0
775,590000.0,"Swiftstone Tower, 2 Peartree Way, LONDON, SE10",SE10,2.0
776,399995.0,"Imperial Building, Duke of Wellington Avenue, Royal Arsenal, SE18",SE18,1.0
777,350000.0,"Agora Court, Kidbrooke Village, SE3",SE3,0.0
778,425000.0,Trafalgar Road London SE10,SE10,3.0
779,465000.0,"Brumwell Avenue, Woolwich, London, SE18",SE18,2.0
780,530000.0,"Brumwell Avenue, Woolwich, London, SE18",SE18,3.0
782,275000.0,"Waverley Road, London, SE18",SE18,2.0
783,355000.0,"Brumwell Avenue, Woolwich, London, SE18",SE18,1.0
784,499000.0,"Brumwell Avenue, Woolwich, London, SE18",SE18,2.0
785,325000.0,"Ellington House, Ashmore Road, London, SE18",SE18,2.0
787,575000.0,"Abergeldie Road, Lee, SE12",SE12,3.0
788,525000.0,"Victory Parade, Plumstead Road, Royal Arsenal Riverside, Woolwich, London, SE18",SE18,2.0
789,500000.0,"Merriman Road, London, SE3",SE3,3.0
790,875000.0,Ormiston Road London SE10,SE10,3.0
792,2500000.0,"Foyle Road, Blackheath, London, SE3",SE3,5.0
793,275000.0,"Greenbay Road, Charlton, SE7",SE7,2.0
795,280000.0,"Watergate Street, London, SE8 3HH",SE8,1.0
796,630000.0,"Beacon Point, 12 Dowells Street, Greenwich, London, SE10",SE10,2.0
797,116250.0,"Perkins House, London, SE3",SE3,2.0
798,140000.0,"Noble House, London, SE3",SE3,3.0
799,118750.0,"Noble House, London, SE3",SE3,2.0
800,550000.0,"Duke of Wellington Avenue, London, SE18",SE18,2.0
801,650000.0,"Minotaur House, 3 Thunderer Walk, London, SE18",SE18,2.0
802,393000.0,"Edison Court, Schoolbank Road, London, SE10",SE10,3.0
803,655000.0,"Edison Court, Schoolbank Road, London, SE10",SE10,3.0
804,235000.0,"Brook Square, London, SE18",SE18,1.0
805,905000.0,"Upper Riverside, 10 Cutter Lane, Greenwich Peninsula, SE10 0XX",SE10,2.0
806,890000.0,"Balcaskie Road, Eltham SE9",SE9,4.0
807,425000.0,"Tizzard Grove, London, SE3",SE3,1.0
810,539995.0,"Plum Lane, London, SE18",SE18,3.0
811,1150000.0,"Straightsmouth, Greenwich, London, SE10 9LB",SE10,4.0
812,535000.0,Mycenae Road London SE3,SE3,2.0
813,385000.0,"The Lighterman, 1 Pilot Walk, Lower Riverside, Greenwich Peninsula, SE10",SE10,0.0
814,490000.0,Ashmore Road London SE18,SE18,2.0
815,325000.0,"Brook Square, Shooter`s Hill, SE18 4NB",SE18,2.0
817,440000.0,"Restons Crescent, Eltham, London, SE9",SE9,3.0
818,465000.0,"Dowding Drive, Blackheath, London, SE9",SE9,2.0
819,350000.0,"Hervey Road, London, SE3",SE3,1.0
820,505000.0,Condover Crescent London SE18,SE18,3.0
821,580000.0,"Parkside, Vanbrugh Fields, London, SE3",SE3,2.0
822,575000.0,"Building 22, Cadogan Road, London, SE18",SE18,3.0
823,275000.0,"Galton House, Shooters Hill Road, London, SE18",SE18,1.0
824,550000.0,"Parkside, Vanbrugh Fields, Blackheath, London, SE3",SE3,2.0
825,1015000.0,"Royal Arsenal Riverside, 
London, 
SE18
",SE18,3.0
826,450000.0,"Lannoy Road, London, SE9",SE9,2.0
827,585000.0,"Stretton Mansions, Glashier Street, Deptford, SE8",SE8,2.0
828,500000.0,"Dowells Street, London, SE10 9DY",SE10,2.0
829,200000.0,"Combwell Crescent, Abbey Wood, SE2 9NB",SE2,2.0
830,400000.0,"The Lighterman, 1 Pilot Walk, Greenwich Peninsula, SE10",SE10,0.0
831,575000.0,Shooters Hill Road London SE3,SE3,2.0
832,499000.0,"McMillan Street, London, SE8",SE8,2.0
834,670000.0,"Waterfront III,  Royal Arsenal Riverside, SE18",SE18,2.0
835,640000.0,"Waterfront III,  Royal Arsenal Riverside, SE18",SE18,2.0
837,650000.0,"Waterfront III,  Royal Arsenal Riverside, SE18",SE18,2.0
839,225000.0,"Southwood Road, New Eltham, London, SE9",SE9,1.0
840,650000.0,"Lambourne Place, Blackheath, London, SE3",SE3,3.0
841,200000.0,"Restons Crescent, Sidcup, Kent, SE9",SE9,2.0
842,465000.0,Dowells Street London SE10,SE10,2.0
844,250000.0,Heathfield Terrace London SE18,SE18,2.0
845,700000.0,"Nadine Street, Charlton, SE7",SE7,4.0
846,2500000.0,"Vanbrugh Castle, Maze Hill, Greenwich, London, SE10",SE10,4.0
848,400000.0,Whetstone Road London SE3,SE3,3.0
849,2500000.0,Westgrove Lane London SE10,SE10,5.0
850,410000.0,"Duke of Wellington Avenue, Woolwich, London, SE18",SE18,0.0
851,300000.0,Eaglesfield Road London SE18,SE18,2.0
853,360000.0,Marmadon Road London SE18,SE18,3.0
855,1325000.0,"Waterfront III, Royal Arsenal Riverside Woolwich, SE18",SE18,2.0
856,477500.0,"Building 10, Royal Arsenal Riverside Woolwich, SE18",SE18,1.0
857,672000.0,"Building 10, Royal Arsenal Riverside Woolwich, SE18",SE18,2.0
858,492500.0,"Navigator Wharf, Royal Arsenal Riverside Woolwich, SE18",SE18,1.0
859,625000.0," Nectarine Way,  Lewisham, SE13",SE13,3.0
860,310000.0,Ashmore Road London SE18,SE18,1.0
861,250000.0,"Cantwell Road, Shooters Hill, London, SE18",SE18,2.0
863,220000.0,"Brookhill Road, Woolwich, London, SE18",SE18,1.0
864,425000.0,"Shooters Hill Road, Blackheath, London, SE3",SE3,2.0
865,350000.0,"Hervey Road, Blackheath, SE3",SE3,1.0
866,245000.0,Brook Square London SE18,SE18,1.0
867,405000.0,"Ossel House, Cable Walk, Enderby Wharf, London, SE10 0EH",SE10,1.0
868,775000.0,"Earlshall Road, Eltham, SE9",SE9,4.0
870,760000.0,John Donne Way Greenwich SE10,SE10,3.0
873,550000.0,"Brinklow Crescent, Shooters Hill, SE18 3BS",SE18,4.0
874,279950.0,"Cole Close, London, SE28",SE28,3.0
876,300000.0,"Stanley Close, London, SE9",SE9,2.0
877,108600.0,Seren Park Gardens London SE3,SE3,1.0
878,362000.0,Seren Park Gardens London SE3,SE3,1.0
881,350000.0,Shooters Hill Road London SE18,SE18,2.0
882,265000.0,"Kidbrooke Grove, London, SE3",SE3,0.0
883,285000.0,"Bridge House, London, SE28 0NR",SE28,2.0
884,230000.0,"Bloomfield Road, Woolwich, London, SE18",SE18,1.0
885,150000.0,"Footscray Road, New Eltham, London, SE9",SE9,1.0
886,1299995.0,"Ashburnham Place, Greenwich, London, SE10",SE10,3.0
887,550000.0,"30 River Gardens Walk, Greenwich, SE10",SE10,2.0
889,450000.0,"Jubilee Court , Victoria Parade, London, SE10 9FJ",SE10,1.0
892,1299500.0,Ashburnham Place London SE10,SE10,3.0
893,510000.0,"Arora Tower, North Greenwich, SE10",SE10,1.0
894,510000.0,"Arora Tower, North Greenwich, SE10",SE10,1.0
895,389000.0,Lambarde Square Greenwich SE10,SE10,1.0
896,875000.0,"Grove Hall, 10-12 West Grove, London, SE10",SE10,2.0
897,375000.0,"Shooters Hill Road, Greenwich, London, SE3",SE3,2.0
899,1600000.0,"Macartney House, Chesterfield Walk, London, SE10",SE10,4.0
901,1300000.0,"Macartney House, Chesterfield Walk, Greenwich, London, SE10",SE10,3.0
902,525000.0,"Seren Park Gardens, Greenwich, SE3",SE3,2.0
904,730000.0,"Kinveachy Gardens, Charlton, SE7",SE7,3.0
906,725000.0,Burgos Grove London SE10,SE10,3.0
907,850000.0,Meadowcourt Road Blackheath SE3,SE3,4.0
908,335000.0,Langhorne Street London SE18,SE18,1.0
909,450000.0,"Blanmerle Road, London SE9",SE9,3.0
910,1075000.0,Admirals Gate Greenwich SE10,SE10,3.0
911,660000.0,Nevada Street London SE10,SE10,2.0
912,900000.0,"Greenwich Academy, 50 Blackheath Road, Greenwich, London, SE10",SE10,4.0
913,499950.0,Shooters Hill Road London SE3,SE3,2.0
914,395000.0,Cyrus Field Street Greenwich SE10,SE10,1.0
915,138250.0,"Drummond House, Victory Parade, Royal Arsenal Riverside, Woolwich, London, SE18",SE18,1.0
916,525000.0,"Holly Court, John Harrison Way, LONDON, SE10",SE10,3.0
917,725000.0,Earlswood Street Greenwich SE10,SE10,2.0
918,795000.0,Pegler Square London SE3,SE3,3.0
920,465000.0,"Kidbrooke Village, Kidbrooke, London, SE3",SE3,1.0
921,467500.0,"Kidbrooke Village, Kidbrooke, London, SE3",SE3,1.0
922,470000.0,"Kidbrooke Village, Kidbrooke, London, SE3",SE3,1.0
923,472500.0,"Kidbrooke Village, Kidbrooke, London, SE3",SE3,1.0
924,475000.0,"Kidbrooke Village, Kidbrooke, London, SE3",SE3,1.0
925,475000.0,"Sidcup Road, Mottingham, SE9",SE9,3.0
926,477500.0,"Kidbrooke Village, Kidbrooke, London, SE3",SE3,1.0
927,452500.0,"Kidbrooke Village, Kidbrooke, London, SE3",SE3,1.0
928,462500.0,"Kidbrooke Village, Kidbrooke, London, SE3",SE3,1.0
929,462500.0,"Kidbrooke Village, Kidbrooke, London, SE3",SE3,1.0
930,460000.0,"Kidbrooke Village, Kidbrooke, London, SE3",SE3,1.0
931,460000.0,"Kidbrooke Village, Kidbrooke, London, SE3",SE3,1.0
932,457500.0,"Kidbrooke Village, Kidbrooke, London, SE3",SE3,1.0
933,457500.0,"Kidbrooke Village, Kidbrooke, London, SE3",SE3,1.0
934,465000.0,"Kidbrooke Village, Kidbrooke, London, SE3",SE3,1.0
935,455000.0,"Kidbrooke Village, Kidbrooke, London, SE3",SE3,1.0
936,455000.0,"Kidbrooke Village, Kidbrooke, London, SE3",SE3,1.0
937,452500.0,"Kidbrooke Village, Kidbrooke, London, SE3",SE3,1.0
938,477500.0,"Kidbrooke Village, Kidbrooke, London, SE3",SE3,1.0
939,477500.0,"Kidbrooke Village, Kidbrooke, London, SE3",SE3,1.0
940,480000.0,"Kidbrooke Village, Kidbrooke, London, SE3",SE3,1.0
941,487500.0,"Kidbrooke Village, Kidbrooke, London, SE3",SE3,1.0
942,487500.0,"Kidbrooke Village, Kidbrooke, London, SE3",SE3,1.0
943,510000.0,"Kidbrooke Village, Kidbrooke, London, SE3",SE3,1.0
944,510000.0,"Kidbrooke Village, Kidbrooke, London, SE3",SE3,1.0
945,550000.0,"Kidbrooke Village, Kidbrooke, London, SE3",SE3,1.0
946,500000.0,"Meadowside, Kidbrooke, London, SE9",SE9,2.0
950,290000.0,"Corelli Road, Shooters Hill, London, SE3",SE3,1.0
951,900000.0,"Royal Arsenal Riverside, 
London, 
SE18
",SE18,2.0
952,229995.0,"Brookhill Road, London, SE18",SE18,1.0
953,350000.0,"Battery Road, West Thamesmead, SE28 0JS",SE28,3.0
954,505000.0,"No 3, 8 Cutter Lane, Upper Riverside, Greenwich Peninsula, SE10",SE10,0.0
955,505000.0,Brookhill Road London SE18,SE18,4.0
956,450000.0,"Hutchins Road, London, SE28",SE28,3.0
957,795000.0,"Norton House, Duke of Wellington Avenue, London, SE18",SE18,2.0
958,675000.0,Hollymount Close London SE10,SE10,3.0
959,375000.0,"1 Tarves Way, Greenwich, SE10",SE10,1.0
960,475000.0,Handley Drive Kidbrooke Village SE3,SE3,2.0
961,425000.0,Rainham Close London SE9,SE9,3.0
962,2200000.0,Shooters Hill Road Blackheath SE3,SE3,7.0
964,425000.0,"Maltby House, 2 Ottley Drive, Kidbrooke Village, London, SE3",SE3,2.0
966,1185000.0,"No. 5, 2 Cutter Lane, Upper Riverside, Greenwich Peninsula, SE10",SE10,3.0
967,350000.0,"Eltham Hill, Eltham SE9",SE9,2.0
969,300000.0,"Griffin Road, Plumstead, SE18",SE18,2.0
970,365000.0,"Marmadon Road, Plumstead, London, SE18 1EQ",SE18,2.0
971,865000.0,"Hawthorne Crescent, Greenwich, London, SE10",SE10,4.0
972,375000.0,"Whitworth Road, Shooters Hill / Woolwich, SE18",SE18,2.0
973,485000.0,"Moordown, Shooters Hill, SE18",SE18,3.0
974,520000.0,"Becquerel Court, School Square, Greenwich, SE10",SE10,2.0
975,204995.0,"Charlesmere Gardens, West Thamesmead, SE28 0NG",SE28,1.0
978,499999.0,Vanbrugh Hill London SE10,SE10,2.0
980,350000.0,"Nethercombe House, Ruthin Road, Blackheath, SE3",SE3,2.0
981,280000.0,"Corelli Road, Shooters Hill, SE3",SE3,1.0
982,420000.0,"Grayston House, 21 Astell Road, LONDON, SE3",SE3,1.0
986,380000.0,"Hopgood Tower, Kidbrooke Village SE3",SE3,1.0
987,395000.0,"22 John Harrison Way, Greenwich Peninsula, London, SE10",SE10,0.0
988,400000.0,"Coleraine Road, Blackheath, London, SE3",SE3,3.0
989,605000.0,"No 5, 2 Cutter Lane, Upper Riverside, Greenwich Peninsula, SE10",SE10,1.0
991,810000.0,"No 5, 2 Cutter Lane, Upper Riverside, Greenwich Peninsula, SE10",SE10,2.0
992,540000.0,"Dairsie Road, London, SE9",SE9,3.0
993,235000.0,Wrottesley Road London SE18,SE18,2.0
994,365000.0,"Westhorne Avenue, London, SE12",SE12,3.0
996,425000.0,"King William Walk, Greenwich, SE10",SE10,1.0
997,775000.0,Crown Woods Way London SE9,SE9,4.0
998,825000.0,"Tidemill Square, North Greenwich, London, SE10",SE10,3.0
999,635000.0,"Upper Riverside, 10 Cutter Lane, Greenwich Peninsula, SE10 0XX",SE10,1.0
1000,697500.0,"Royal Arsenal Riverside, 
London, 
SE18
",SE18,2.0
1001,850000.0,Commerell Street London SE10,SE10,3.0
1003,340000.0,"Deals Gateway, Greenwich, London, SE10",SE10,1.0
1006,350000.0,"Plumstead Common Road, London, SE18",SE18,2.0
1007,265000.0,"Elliscombe Road, Charlton, SE7",SE7,1.0
1008,575000.0,Colomb Street London SE10,SE10,2.0
1009,399995.0,"West Park, Mottingham, London, SE9",SE9,2.0
1010,325000.0,"Brook Square, Blackheath, London, SE18",SE18,2.0
1011,700000.0,"Craigerne Road, London, SE3",SE3,4.0
1012,850000.0,"Morden Road, Blackheath, London, SE3",SE3,3.0
1014,295000.0,Pettacre Close London SE28,SE28,2.0
1017,899995.0,Woolwich Road London SE10,SE10,6.0
1018,270000.0,"The Vista, Eltham, SE9",SE9,2.0
1020,500000.0,"Hazel Lane, Greenwich, SE10",SE10,2.0
1021,1200000.0,"Birch House, Kidbrooke Village, SE3",SE3,3.0
1022,325000.0,"Brook Square, Shooters Hill, SE18",SE18,2.0
1024,315000.0,"Fairlands Court, Eltham SE9",SE9,2.0
1025,740000.0,"Banning Street,
London,
SE10",SE10,3.0
1026,499950.0,John Harrison Way Greenwich SE10,SE10,2.0
1027,379000.0,"Tizzard Grove, Kidbrooke, London, SE3",SE3,1.0
1028,575000.0,"Ossel Court, 13 Telegraph Avenue, Greenwich, London, SE10",SE10,2.0
1029,320000.0,"Well Hall Road, London, SE9",SE9,3.0
1030,2500000.0,"Foyle Road, Blackheath, London, SE3",SE3,5.0
1034,550000.0,"Peartree Way, London, SE10",SE10,2.0
1035,285000.0,Langhorne Street Woolwich SE18,SE18,1.0
1036,380000.0,"Glaisher Street, Greenwich, London, SE8",SE8,1.0
1037,800000.0,"Combedale Road, London, SE10",SE10,4.0
1038,375000.0,Blackheath Hill London SE10,SE10,3.0
1039,225000.0,"Cookhill Road, London, SE2 9PD",SE2,2.0
1041,615000.0,"11 Lambarde Square, Greenwich, SE10",SE10,2.0
1042,635000.0,River Gardens Walk Greenwich SE10,SE10,2.0
1043,650000.0,"Garda House, 5 Cable Walk, London, SE10",SE10,3.0
1045,550000.0,"Coleraine Road, Blackheath, London, SE3",SE3,3.0
1046,575000.0,"Merriman Road, Blackheath, London, SE3",SE3,5.0
