,price,address,postcode,number_bedrooms
624,475000.0,"Ireland Place, London, N22",N22,2.0
625,475000.0,"Church Lane, N8",N8,2.0
627,575000.0,"Eleanor Road, Bounds Green, London, N11",N11,2.0
628,375000.0,"Russell Road, London, N13",N13,2.0
629,379995.0,"Chandos Road, London, N17",N17,2.0
630,309995.0,"Pembury Road, London, N17",N17,1.0
631,360000.0,"Sutherland Road, Tottenham, London, N17",N17,2.0
633,375000.0,"Cline Road, Bounds Green, London, N11",N11,2.0
635,3999950.0,"Cholmeley Park, London, N6",N6,5.0
636,1160000.0,"Blake Road, London, N11",N11,4.0
637,2650000.0,"Cholmeley Park, London, N6",N6,5.0
638,400000.0,"Campsbourne Road, Crouch End, London, N8",N8,2.0
639,700000.0,"Hermitage Road, South Tottenham, London, N15",N15,4.0
640,2650000.0,"Cholmeley Park, Highgate, London, N6",N6,5.0
641,375000.0,"The Avenue, London, N17",N17,1.0
642,465000.0,"Shobden Road, Tottenham, N17",N17,2.0
644,460000.0,"Denmark Street, London, N17",N17,3.0
645,585000.0,"High Street, Hornsey, London, N8",N8,2.0
646,460000.0,"Denmark Street, London, N17",N17,3.0
648,300000.0,"Tredegar Road, Bounds Green N11",N11,1.0
649,450000.0,"Dagmar Road, Alexandra Palace, N22",N22,2.0
650,715000.0,"Linley road, london, N17",N17,4.0
654,650000.0,"Parkgate Mews, Highate, N6",N6,2.0
655,285000.0,"Birkbeck Road, Hornsey, London, N8",N8,1.0
658,300000.0,"Cordell House, Newton Road, London, N15",N15,2.0
660,700000.0,"Nelson Road, Crouch End, London, N8",N8,3.0
661,499950.0,"Stanhope Road, Highgate, London, N6",N6,2.0
662,329950.0,"Parkside Court, 135 Palmerston Road, London, N22",N22,2.0
663,494500.0,"RISE, Lock17, N17",N17,2.0
664,315500.0,"RISE, Lock17, N17",N17,0.0
666,575000.0,"Broadway Parade, Crouch End, N8",N8,3.0
668,1875000.0,"Creighton Avenue, Muswell Hill, London, N10",N10,5.0
671,350000.0,"Cross Lane,
Hornsey,
London,
N8",N8,0.0
672,585000.0,"Cross Lane,
Hornsey,
London,
N8",N8,2.0
673,325000.0,Foyle Road N17,N17,1.0
674,590000.0,"Cross Lane,
Hornsey,
London,
N8",N8,2.0
675,1750000.0,"Kings Avenue, Muswell Hill, London, N10",N10,4.0
676,595000.0,"Cross Lane,
Hornsey,
London,
N8",N8,2.0
677,600000.0,"Cross Lane,
Hornsey,
London,
N8",N8,2.0
678,225000.0,"Haynes Close, Tottenham, N17",N17,1.0
679,2495000.0,"Stanhope Gardens, Highgate, London N6",N6,5.0
683,389000.0,"Westbury Avenue, London, N22",N22,2.0
685,775000.0,"Winchelsea road, london, N17",N17,6.0
686,325000.0,"Lois Court, Tottenham, N17",N17,3.0
689,320000.0,Bronhill Terrace N17,N17,2.0
690,455000.0,"Wightman Road, London, N8",N8,2.0
691,1450000.0,"New Road, N8",N8,4.0
693,500000.0,"Compass Court, Smithfield Square, Hornsey, N8",N8,2.0
696,800000.0,"Dorset Road, London, N15",N15,4.0
697,380000.0,"Granville Road, Wood Green, N22",N22,2.0
698,449000.0,"White Hart Lane,
London,
N17 7NA",N17,2.0
699,434000.0,"White Hart Lane,
London,
N17 7NA",N17,2.0
700,1200000.0,"Muswell Avenue, Muswell Hill, London, N10",N10,3.0
701,499000.0,"White Hart Lane,
London,
N17 7NA",N17,3.0
702,425000.0,"White Hart Lane,
London,
N17 7NA",N17,2.0
703,425000.0,"Lyndhurst Road, Wood Green, N22",N22,2.0
704,345000.0,"St. Michael'S Terrace, Alexandra Park, London, N22",N22,1.0
705,400000.0,"Awlfield Ave, n17",n17,2.0
707,1395000.0,"Acorn Terrace, Archway Road, London, N6",N6,4.0
708,675000.0,"Cumberland Road, Alexandra Park, London, N22",N22,3.0
710,550000.0,"Page Green Road, Seven Sisters, London, N15",N15,2.0
711,525000.0,"Crouch End Hill, Crouch End, London, N8",N8,2.0
712,800000.0,"Birchington Road, Crouch End, London, N8",N8,2.0
713,724999.0,"Walpole Road, London, N17",N17,4.0
715,450000.0,"Peabody Estate, Lordship Lane, London, UK, N17 7QJ",N17,3.0
717,350000.0,"Elm Place, Bruce Grove, N17",N17,1.0
718,475000.0,"Park View Road, Tottenham, Haringey, London, N17",N17,3.0
720,575000.0,"Colney Hatch Lane, Muswell Hill, London, N10",N10,2.0
722,800000.0,"Lausanne Road, Crouch End, London, N8",N8,5.0
723,3000000.0,"Church Vale, London, N2",N2,5.0
724,706000.0,"Apartment W.22, 1 Ashley Road, Tottenham Hale, N17",N17,3.0
725,475000.0,"Avondale Road, London, N15",N15,2.0
727,575000.0,"Hewitt Avenue, London, N22",N22,3.0
728,399999.0,"North Point, Tottenham Lane, N8",N8,1.0
729,1125000.0,"Southwood Park, London, N6",N6,3.0
730,775000.0,"Rookfield Close, Muswell Hill, London, N10",N10,3.0
732,1295000.0,"Hornsey Lane Gardens, Highgate, London, N6",N6,4.0
733,800000.0,"Lausanne Road, Harringay, N8",N8,5.0
737,900000.0,"Crouch End,London,N8",N8,3.0
738,325000.0,"Hollam House, Denmark Road, Haringey, London, N8",N8,2.0
741,600000.0,"Clyde Road, London, N15",N15,2.0
743,1250000.0,"Eden House, Crouch End, N8",N8,2.0
744,1250000.0,"Duplex Penthouse, Eden House, N8",N8,2.0
746,399950.0,"Video Court, Mount View Road, London, N4",N4,1.0
747,375000.0,"Mount Pleasant Road, London, N17",N17,2.0
748,565000.0,"Emily Bowes Court, 
Lebus Street, 
London, 
N17",N17,2.0
749,475000.0,"Maybury Mews, London, N6",N6,2.0
751,430000.0,"Emily Bowes Court, 
Lebus Street, 
London, 
N17",N17,1.0
753,725000.0,"Waldegrave Road, London, N8",N8,3.0
754,750000.0,"Priory Road, Crouch End N8",N8,2.0
755,795000.0,"Osier Crescent, Muswell Hill, London, N10",N10,4.0
757,450000.0,"Sirdar Road, London, N22",N22,2.0
758,560000.0,"Baronet Grove, London, Haringey, London, N17",N17,3.0
759,450000.0,"West Green Road, London, N15",N15,2.0
760,590000.0,"Cross Lane,
Hornsey,
London,
N8",N8,2.0
761,399999.0,"Saxon Chase, Dickenson Road, N8",N8,1.0
762,575000.0,"Oulton Road, Tottenham, London, N15",N15,2.0
763,550000.0,"Arnold Road, London, N15",N15,2.0
767,599995.0,"Sandford Avenue, Wood Green, N22",N22,5.0
768,550000.0,"Morley Avenue, London, N22",N22,3.0
769,475000.0,"Victoria Road, London, N22",N22,1.0
770,365000.0,"Connaught Road, London, N4",N4,1.0
771,475000.0,"Amazon Apartments, New River Avenue, N8 ",N8,2.0
772,270000.0,"Culpepper Close, Edmonton, London, N18",N18,2.0
773,320000.0,"Helston Court, Culvert Road Seven Sisters, London, N15",N15,2.0
775,299000.0,"High Street, Hornsey, London, N8",N8,1.0
776,1999500.0,"Cairncross Mews, N8 ",N8,5.0
777,400000.0,"Winkfield Road, Wood Green, London, N22",N22,2.0
779,300000.0,"Sidney Avenue, Palmers Green, N13",N13,1.0
780,950000.0,"Sydney Road, Harringay Ladder, London, N8",N8,4.0
782,599999.0,"Frobisher Road, London, N8",N8,2.0
783,650000.0,"Cecile Park, Crouch End, London, N8",N8,2.0
786,1999500.0,"Cairncross Mews, Felix Avenue, Crouch End, London, N8",N8,5.0
787,500000.0,"Crescent Road, London, N8",N8,2.0
788,325000.0,"Langhedge Lane, London, UK, N18 2TJ",N18,3.0
789,285000.0,"Scotland Green, Tottenham, London, N17",N17,1.0
790,435000.0,"Dongola Road, Tottenham, N17",N17,3.0
791,425000.0,"Carlingford Road, Haringey, N15",N15,2.0
792,950000.0,"Aylmer Road, East Finchley, London, N2",N2,2.0
794,435000.0,"White Hart Lane,
London,
N17 7NA",N17,2.0
795,725000.0,"Harringay Road, London, N15",N15,5.0
796,340000.0,"Flat 10  Reygate Court, Warwick Gardens, N4",N4,1.0
797,935000.0,"Effingham Road, London, N8",N8,4.0
799,299000.0,"High Street, Hornsey, London, N8",N8,1.0
800,1750000.0,"Glasslyn Road, N8",N8,5.0
802,720000.0,"Southwood Lane, Highgate, London N6",N6,2.0
803,610000.0,"Napier Road, London, N17",N17,3.0
804,650000.0,"Princes Avenue, Palmers Green, London, N13",N13,4.0
805,399950.0,"Tetherdown, Muswell Hill, London, N10",N10,1.0
806,400000.0,"Fortis Green, East Finchley, N2",N2,1.0
807,355000.0,"High Street, N8",N8,0.0
808,780000.0,"High Street, N8",N8,3.0
809,650000.0,"High Street, N8",N8,2.0
810,455000.0,"High Street, N8",N8,1.0
811,350000.0,"Nightingale Road, London, N22",N22,1.0
814,66250.0,"Alice Court, Wood Green, London, N22",N22,1.0
816,1575000.0,"Kensington Place, Muswell Hill, London, N10",N10,4.0
817,1395000.0,"Kensington Place, Muswell Hill, London, N10",N10,3.0
818,1695000.0,"Kensington Place, Muswell Hill, London, N10",N10,4.0
819,425000.0,"Lyndhurst Road, London, N22",N22,2.0
820,425000.0,"Maryland Road, London, N22",N22,2.0
822,500000.0,"Evesham Road, London, N11",N11,3.0
823,2300000.0,"Yew Tree Close, Muswell Hill, London, N22",N22,5.0
824,485000.0,"Hatherley Gardens, Crouch End, London, N8",N8,1.0
825,1500000.0,"Victoria Road, N22",N22,5.0
826,600000.0,High Street Smithfield Square N8,N8,2.0
827,1950000.0,"Milton Park, Highgate, London, N6",N6,6.0
828,419000.0,"High Road, London, N22",N22,2.0
830,534950.0,"Everington Road, Muswell Hill, N10",N10,2.0
832,425000.0,"Maidstone Road, London, N11",N11,2.0
833,475000.0,"Hatherley Gardens, Crouch End, London, N8",N8,1.0
835,500000.0,"Sylvan Avenue, Wood Green, London, N22",N22,2.0
836,1950000.0,"Milton Park, Highgate, N6",N6,6.0
837,535000.0,"Westbeech Road, Turnpike Lane, London, N22",N22,2.0
841,475000.0,"Alexandra Park Road, Muswell Hill, London, N10",N10,2.0
842,535000.0,"Westbeech Road, Noel Park, N22",N22,2.0
843,284950.0,Stoneleigh Road N17,N17,1.0
844,509950.0,Southey Road N15,N15,2.0
845,675000.0,"Granville Road, Stroud Green N4",N4,2.0
846,535000.0,"Lascotts Road, London, N22",N22,3.0
847,415000.0,"Haslemere Road, Crouch End, London, N8",N8,1.0
848,640000.0,"Highview, Shepherds Hill, London, London, N6",N6,2.0
849,685000.0,"Smithfield Yard, Cross Lane N8  (Apartment A-6-02) ",N8,2.0
850,240000.0,"Compton Crescent, London N17",N17,1.0
851,695000.0,"Smithfield Yard, Cross Lane N8  (Apartment A-6-01) ",N8,2.0
852,525000.0,"Allison Road, Harringay, London, N8",N8,2.0
854,450000.0,"Albert Close, N22",N22,3.0
855,800000.0,"Rookfield Close, Muswell Hill, N10",N10,3.0
856,16999999.0,"Courtenay Avenue, Highgate, London, N6",N6,9.0
860,365000.0,"Gilson Place, Coppetts Road, London, N10",N10,2.0
861,435000.0,"High Road, Tottenham, London, N15",N15,2.0
864,550000.0,"Whittington Road, London, N22",N22,2.0
865,450000.0,"Sirdar Road, London, N22",N22,2.0
866,950000.0,"Falkland Road, Harringay Ladder, London, N8",N8,4.0
867,1700000.0,"Muswell Hill Road, London, N10",N10,6.0
868,1000000.0,"Parklands, Highgate, N6",N6,2.0
869,750000.0,"Uplands Road, N8",N8,3.0
872,580000.0,"Thornaby Gardens, Edmonton, N18",N18,5.0
873,580000.0,"Thornaby Gardens, London, N18",N18,5.0
876,3250000.0,"Cholmeley Park, Highgate, N6",N6,7.0
879,2495000.0,"Claremont Road, London, N6",N6,5.0
880,300000.0,"Hampden Road, London, N8",N8,1.0
881,965000.0,"Frobisher Road, Harringay Ladder, London, N8",N8,5.0
884,445000.0,Compton Crescent N17,N17,3.0
885,450000.0,"Perth Road, London, N22",N22,2.0
886,2000000.0,"Langdon Park Road, N6",N6,6.0
887,550000.0,"Hill Road, Muswell Hill, N10 ",N10,2.0
888,300000.0,"Monument Way, Tottenham, N17",N17,1.0
889,500000.0,"Harvey Road, Crouch End, London, N8",N8,2.0
890,800000.0,"Effingham Road, Harringay, London, N8",N8,3.0
891,395000.0,"Hawthorne Road, Edmonton, London, N18",N18,3.0
892,475000.0,"Falkland Road, London, N8",N8,2.0
893,515000.0,"Westbury Avenue, London, N22",N22,2.0
894,280000.0,"Stonebridge Road, London, N15",N15,1.0
895,575000.0,"Shepherds Hill, Highgate, London, N6",N6,2.0
896,650000.0,"Topsfield Parade, Tottenham Lane, N8",N8,4.0
897,450000.0,"Stanmore Road, London N15",N15,2.0
898,629995.0,"Fenton road, london, N17",N17,5.0
901,925000.0,"Milton Road, Highgate N6",N6,3.0
903,999950.0,"Printworks, Crouch End, N8 ",N8,3.0
904,499950.0,"Park Road, N8",N8,2.0
905,390000.0,"Chesterfield Gardens, Harringay, London, N4",N4,1.0
906,799999.0,"High Sheldon, Sheldon Avenue, Highgate, N6",N6,2.0
908,375000.0,"Green Lanes, London, N8",N8,2.0
909,740000.0,"Livingstone Road, London, N13",N13,4.0
911,2500000.0,"Langdon Park Road, London, N6",N6,7.0
912,560000.0,"Baronet Grove, London, N17",N17,3.0
914,1850000.0,"Southwood Lane, Highgate Village N6",N6,5.0
915,390000.0,"Mount Pleasant Road,, London, N17",N17,2.0
918,700000.0,"Roslyn Road, Seven Sisters, N15",N15,3.0
919,850000.0,"Wightman Road, London, N4",N4,4.0
920,695000.0,"Priory Road, Crouch End, London, N8",N8,2.0
921,459000.0,"White Hart Lane,
London,
N17 7NA",N17,2.0
922,466000.0,"White Hart Lane,
London,
N17 7NA",N17,2.0
923,725000.0,"Muswell Avenue, London, N10",N10,3.0
924,1650000.0,"Southern Road, London, N2",N2,5.0
925,1200000.0,"Muswell Avenue, Muswell Hill, London, N10",N10,3.0
927,475000.0,"Avenue Road,London,N6",N6,1.0
929,575000.0,"Burgoyne Road, Harringay, London, N4",N4,2.0
930,400000.0,"Campsbourne Road, Crouch End, N8",N8,1.0
931,550000.0,"Curzon Road, Muswell Hill, London, Greater London, N10",N10,2.0
932,2595000.0,"Talbot Road, Highgate, London, N6",N6,6.0
934,750000.0,"Coolhurst Road, London, N8",N8,2.0
935,475000.0,"Tetherdown, Muswell Hill, N10",N10,2.0
937,475000.0,"Langdon Park Road, Highgate, N6",N6,1.0
938,1400000.0,"Stapleton Hall Road, N4 3QE",N4,5.0
939,350000.0,"Cornwall Road, London, N15",N15,2.0
940,475000.0,"Amazon Apartments, New River Village, Hornsey, N8",N8,2.0
941,570000.0,"Downhills Way, Tottenham, London, N17",N17,3.0
942,900000.0,"Rectory Gardens, Hornsey, N8",N8,3.0
943,674950.0,"Hornsey Town Hall, Crouch End, London, N8",N8,2.0
944,375000.0,"Princes Avenue, Palmers Green, London, N13",N13,2.0
946,650000.0,"Melbourne Avenue, London, N13",N13,4.0
947,390000.0,"Chesterfield Gardens, London, N4",N4,1.0
948,350000.0,"Upper Tollington Park, London, N4",N4,1.0
950,2250000.0,"Eastern Road, East Finchley, London, N2",N2,4.0
951,400000.0,"Barrington Court, Colney Hatch Lane, London, Greater London, N10",N10,2.0
955,375000.0,"Dukes Avenue, London, N10",N10,1.0
957,460000.0,"Palmerston Road, Bounds Green, N22",N22,2.0
958,549995.0,"Black Boy Lane, London, N15",N15,3.0
959,494500.0,"Ferry Lane,
London,
N17",N17,2.0
960,372500.0,"Ferry Lane,
London,
N17",N17,1.0
961,424950.0,"Weir Hall Avenue, Edmonton, N18",N18,2.0
962,599995.0,"Sandford Avenue, N22",N22,4.0
963,375000.0,"Palace Gates Road, Alexander Park, London, N22",N22,1.0
964,1730000.0,"North Grove, Highgate Village, London N6",N6,2.0
965,675000.0,"Hornsey Lane Gardens, London, N6",N6,2.0
970,1150000.0,"Hornsey Lane Gardens, Highgate,, London, N6",N6,3.0
971,630000.0,"Walpole Road, London, N17",N17,4.0
972,1150000.0,"Hornsey Lane Gardens, Highgate, N6",N6,3.0
974,445000.0,"Kinnear Apartments, New River Village, Hornsey, N8",N8,2.0
976,535000.0,"Lascotts Road, London, N22",N22,3.0
978,437000.0,"Apartment E.35, Ashley Road, Tottenham Hale, N17",N17,1.0
979,400000.0,"Colney Hatch Lane, Muswell Hill, N10",N10,2.0
980,450000.0,"Grimshaw Close, Highgate, London, N6",N6,2.0
983,475000.0,"Colney Hatch Lane, Muswell Hill, London, N10",N10,2.0
984,375000.0,"Whittington Road, Bowes Park, London, N22",N22,2.0
985,276000.0,"Apple Tree Road,
London,
N17 6PN",N17,1.0
988,280000.0,"Apple Tree Road,
London,
N17 6PN",N17,1.0
989,480000.0,"Linkway, London, N4",N4,3.0
992,525000.0,"Butterfly Court, Lawrence Road, Tottenham, N15",N15,2.0
993,385000.0,"Russell Road, London, N15",N15,2.0
994,537500.0,"Butterfly Court, Bathurst Square, London, N15",N15,3.0
995,475000.0,Lorne Road N4 3RU ,N4,2.0
996,270000.0,"Apple Tree Road,
London,
N17 6PN",N17,1.0
997,450000.0,"Tottenham Lane, Crouch End N8",N8,2.0
998,550000.0,"The Chantry, Alexandra Park Road N22",N22,2.0
999,450000.0,"Tottenham Lane, Crouch End, London, N8",N8,2.0
1000,625000.0,"Avenue Lodge, Avenue Road, N6",N6,2.0
1001,1100000.0,"Southwood Avenue, Highgate N6",N6,3.0
1002,375000.0,"Osborne Road, Stroud Green, N4",N4,1.0
1003,315500.0,"Ferry Lane,
London,
N17",N17,0.0
1004,800000.0,"Hawthorn Road, Hornsey, London, N8",N8,3.0
1007,850000.0,"York Road, Bounds Green, London, N11",N11,4.0
1008,335000.0,"Napier Road, Tottenham, London, N17",N17,2.0
1009,495000.0,"Manor Court, N2",N2,2.0
1010,650000.0,"Weston Park, N8",N8,2.0
1011,1600000.0,"Cholmeley Park, London, N6",N6,2.0
1012,725000.0,"Apple Tree Road,
London,
N17 6PN",N17,3.0
1013,1250000.0,"Hornsey Lane Gardens, Highgate, N6",N6,4.0
1015,2150000.0,"Beech Drive, N2",N2,4.0
1018,500000.0,"Avenue Mews, Muswell Hill, London, N10",N10,1.0
1019,350000.0,"Fore Street, Edmonton, London, UK, N18 2FF",N18,2.0
1021,274995.0,"Offord Close, Tottenham, London, UK, N17 0TD",N17,2.0
1022,335000.0,Isobel Place N15,N15,1.0
1024,750000.0,"Copper Beech, North Grove, Highgate, London, N6",N6,1.0
1025,1200000.0,"Muswell Avenue, Muswell Hill, London, N10",N10,3.0
1026,499950.0,"Park Avenue, Alexandra Palace, London, N22",N22,2.0
1027,700000.0,"Mount Pleasant Road, London, N17",N17,3.0
1030,650000.0,"Shepherds Hill, London, N6",N6,2.0
1032,500000.0,"Birkbeck Road, London, N17",N17,4.0
1033,500000.0,"Park Road, Crouch End N8",N8,2.0
1034,400000.0,"Antill Road, Tottenham N15",N15,2.0
1035,385000.0,"Birkbeck Mansions, Birkbeck Road, N8",N8,2.0
1036,575000.0,"Strode Road, Tottenham, London, N17",N17,3.0
1037,700000.0,"Northumberland Grove, LONDON, N17 0PY",N17,5.0
1045,300000.0,"Bounds Green,London N22,N22",N22,1.0
1048,975000.0,"Rathcoole Avenue, London, N8",N8,4.0
1049,349950.0,"Gloucester Road, London, N17",N17,2.0
