,price,address,postcode,number_bedrooms
895,425000,"Heathfield Court, W4",W4,1.0
896,1650000,"St Marys Grove, London, W4",W4,5.0
897,1650000,"St Marys Grove, London, W4",W4,5.0
898,1795000,"Kew Bridge Road, Brentford, TW8",TW8,3.0
899,1895000,"Market Place, The Butts, Brentford, TW8",TW8,5.0
901,1895000,"Market Place, The Butts, Brentford, TW8",TW8,5.0
906,360000,"New Road, 
Feltham, 
Hounslow, 
Greater London, 
TW14 9BT",TW14,2.0
907,394000,"New Road, 
Feltham, 
Hounslow, 
Greater London, 
TW14 9BT",TW14,3.0
909,157500,"Dene Court, Feltham, Hounslow, TW13",TW13,1.0
911,525000,"Marlborough Road, Chiswick, W4",W4,1.0
912,750000,"Kew Bridge Road, Brentford, Middlesex, TW8",TW8,2.0
914,210000,"Central House, Lampton Road, Hounslow, TW3",TW3,0.0
915,2000000,"Gunnersbury Mews, London, W4",W4,5.0
918,325000,"Perkin Close, Hounslow, TW3",TW3,2.0
920,800000,"Pulteney Close, Isleworth, TW7",TW7,3.0
921,1065000,"Kew Bridge Road, Brentford, Middlesex, TW8",TW8,3.0
923,450000,"Heathfield Terrace, London, W4",W4,1.0
925,315000,"Feltham,Middlesex,TW13",TW13,2.0
927,450000,"Arlington Park Mansions, Sutton Lane North, London, W4",W4,1.0
928,2250000,"Chiswick Quay, London, W4",W4,4.0
929,2500000,"Palladian Gardens, Chiswick, London, W4",W4,5.0
933,325000,"Isleworth,Richmond-Upon-Thames,TW7",TW7,2.0
934,1895000,"Bath Road, London, W4",W4,4.0
940,525000,"Argyle Avenue, Hounslow, TW3",TW3,3.0
944,535000,"Central Avenue, Hounslow, TW3",TW3,3.0
945,500000,"Chiswick High Road, Chiswick, London, W4",W4,2.0
948,250000,"Spring Road, Feltham, TW13",TW13,2.0
952,425000,"Guildford Avenue, Feltham, TW13",TW13,3.0
953,280000,"Amesbury Road, Feltham, TW13",TW13,2.0
954,595000,"Sutton Lane North, London, W4",W4,2.0
955,500000,"Thorney Hedge Road, London, W4",W4,1.0
958,425000,"Heathfield Terrace, Chiswick , London , W4",W4,1.0
959,600000,"Pump House Crescent, Brentford, Middlesex, TW8",TW8,2.0
961,1175000,"Corney Reach Way, Chiswick, London, W4",W4,3.0
962,650000,"Syon Court, London Road, TW8",TW8,3.0
963,500000,"Town Meadow, Brentford, TW8 ",TW8,2.0
965,650000,"Herons Place, Isleworth, TW7",TW7,2.0
966,460000,"The Crossways, Heston, TW5",TW5,3.0
969,249950,"Biscoe Close, Hounslow, TW5",TW5,2.0
970,295000,"The Gables, Heston Road, Heston, TW5",TW5,2.0
971,600000,"Kew Bridge Road, Brentford, TW8 ",TW8,2.0
975,369500,"The Brentford Project, 
Catherine Wheel Road,
London, 
TW8 8BD
",TW8,0.0
976,475000,"The Market Building, 6 The Market Place, Brentford, TW8",TW8,1.0
977,550000,"Whitehall Gardens, London, W4",W4,1.0
978,399950,"18 The Grove, Isleworth, TW7",TW7,2.0
979,319950,"Wilkinson House, Draymans Way, Isleworth, Middlesex, TW7",TW7,2.0
980,450000,"Myrtle Court, Baltic Avenue, Brentford, TW8",TW8,2.0
983,290000,"Berberis House, Highfield Road, Feltham, TW13",TW13,2.0
988,550000,"Whitehall Gardens, London, W4",W4,1.0
989,595000,"Browning Way, Heston, TW5",TW5,4.0
990,425000,"Chiswick High Road,, Chiswick, London, W4",W4,0.0
992,575000,"Ash Grove, Hounslow, TW5",TW5,3.0
993,395000,"Talbot Road, Twickenahm, Middlesex TW7",TW7,1.0
994,599950,"Heathfield Court, London, W4",W4,2.0
995,950000,"Queens Gardens, Hounslow, Middlesex, TW5",TW5,10.0
996,950000,"Lion Wharf, Isleworth, TW7",TW7,4.0
997,850000,"Kew Bridge Road, Brentford, Middlesex, TW8",TW8,2.0
998,475000,"Edensor Gardens, Chiswick , London, W4",W4,3.0
1000,2000000,"Oxford Road North, Chiswick, London, W4",W4,4.0
1002,1450000,"Chiswick Quay, Chiswick W4",W4,4.0
1004,795000,"Lanigan Drive, Hounslow, TW3",TW3,4.0
1005,525000,"Chertsey Road, Feltham, Middlesex, TW13",TW13,3.0
1006,489950,"Brabazon Road, Hounslow, TW5",TW5,3.0
1010,850000,"Grantham Road, London, W4",W4,2.0
1012,495000,"Hartington Court, Chiswick, W4",W4,1.0
1025,2600000,"Strand On The Green, Chiswick W4",W4,4.0
1029,600000,"Oast Lodge, Corney Reach Way, London, W4",W4,2.0
1042,265000,"Layton Road, Hounslow, TW3",TW3,2.0
1044,230000,"643-651 Staines Road, Feltham, TW14",TW14,1.0
1046,375000,"Samuelson Place, Isleworth, TW7",TW7,1.0
1048,250000,"Concord Court, Chiswick, London, W4",W4,1.0
