,price,address,postcode,number_bedrooms
801,425000.0,"High Road Leytonstone, Leytonstone, London, E11",E11,2.0
802,420000.0,"High Road -, Leytonstone, London, E11",E11,2.0
803,360000.0,"High Road Leytonstone, Leytonstone, London, E11",E11,1.0
804,499000.0,"High Road Leytonstone, Leytonstone, London, E11",E11,2.0
805,475000.0,"High Road -, Leytonstone, London, E11",E11,2.0
807,600000.0,"Manby Walk, Walthamstow, London, E17",E17,2.0
811,575000.0,"Kings Road, Chingford, London. E4 7HP",E4,4.0
812,675000.0,"Westdown Road, Leyton, London, E15",E15,5.0
814,575000.0,"Broxbourne Road, London, E7 ",E7,3.0
815,620000.0,"Colworth Road, Leytonstone, London, E11",E11,4.0
816,675000.0,"Church Avenue, Highams Park, E4",E4,3.0
817,360000.0,"Grant House, Cleveland Park Avenue, London, E17",E17,1.0
822,400000.0,"107 Albert Road, London, E10",E10,2.0
825,570000.0,"Browning Road,, Bushwood, London, E11",E11,2.0
828,550000.0,"Farmer Road, Leyton,E10",E10,2.0
829,685000.0,"256 Church Road,
Leyton,
London,
E10 7JG",E10,3.0
833,375000.0,"Borwick Avenue, Walthamstow, E17",E17,2.0
834,925000.0,"Hempstead Road, Walthamstow, London, E17",E17,4.0
835,575000.0,"Spencer Road, Walthamstow, London, E17",E17,4.0
836,775000.0,"Frith Road, London, E11",E11,7.0
840,250000.0,"239b Shernhall Street, Walthamstow, E17",E17,2.0
842,425000.0,"Edward Road, Walthamstow, London, E17",E17,2.0
843,450000.0,"Bateman Road, Chingford E4",E4,3.0
844,625000.0,"Penrhyn Grove, Walthamstow, London, E17",E17,3.0
848,265000.0,"Montalt House, Woodford Green, Essex, IG8 ",IG8,1.0
852,475000.0,"Sturge Avenue, Walthamstow, London, E17",E17,3.0
853,370000.0,"Church Road, Leyton, E10",E10,2.0
854,695000.0,"Beulah Road, Walthamstow, London, E17",E17,2.0
855,1400000.0,"Spicer Hall, Buxton Road, London, E4",E4,2.0
856,1400000.0,"Buxton Road, North Chingford, E4",E4,2.0
859,500000.0,"Park Road, Leyton, London, E10",E10,3.0
861,375000.0,"The Arts Apartments, 436-440 Forest Road, Walthamstow, London, E17",E17,1.0
862,375000.0,"Falmouth Way, London, Walthamstow, E17",E17,2.0
863,365000.0,"54 Parade Gardens, Chingford, E4",E4,2.0
864,475000.0,"Forest Road, Walthamstow London E17 4BP - Three Bedroom House ",E17,3.0
866,415000.0,"Cannock Court, Walthamstow, London, E17",E17,2.0
875,525000.0,"Forest View Road, Walthamstow, London, E17",E17,3.0
880,425000.0,"High Road Leyton, London, E15",E15,2.0
881,250000.0,"Chamberlain Place, LONDON, E17 6AY",E17,1.0
883,400000.0,"127c Grange Park Road, Leyton, London, E10 5ET",E10,2.0
884,435000.0,"Buxton Road, Walthamstow, London, E17",E17,2.0
886,375000.0,"Kings Road, Upper Leytonstone, E11",E11,2.0
887,650000.0,"Stewart Road, London, E15",E15,3.0
890,115500.0,"Homebush House, Chingford, E4 7PW",E4,1.0
896,300000.0,"Allen Court, Yunus Khan Close, London, E17",E17,1.0
897,275000.0,"Stapleford Close, Chingford, London, E4",E4,1.0
898,185000.0,"Kingswood Court, Chingford, E4 8LL",E4,1.0
901,540000.0,"Winchester Road Highams Park, London, E4",E4,3.0
902,275000.0,"St. Andrew's Road, Walthamstow E17",E17,1.0
903,450000.0,"The Hale, Highams Park, London. E4 9NS",E4,3.0
904,309995.0,"Repton House, 2 Jacks Farm Way, Highams Park, London. E4 9AE",E4,1.0
905,157500.0,"Cann Hall Road, Leytonstone, London, England, E11",E11,1.0
907,499995.0,"Normanshire Drive, London, E4",E4,3.0
908,475000.0,"Chadwick Road, London, E11",E11,2.0
910,710000.0,"Leasowes Road, Leyton, Waltham Forest, London, E10",E10,5.0
912,310000.0,"Fulbourne Road, Walthamstow, London, E17",E17,2.0
915,175000.0,"Cherrydown Avenue, Chingford , London, Greater London, E4 8DP",E4,0.0
917,445000.0,"76-80 South Grove,
London,
E17",E17,1.0
918,700000.0,"The Risings, London, E17",E17,3.0
919,585000.0,"Drysdale Avenue, London, E4",E4,3.0
921,400000.0,"Grange Park Road, London, E10",E10,2.0
922,625000.0,"Markhouse Road, Walthamstow, London, E17",E17,5.0
924,300000.0,"Montague Road, London, E11",E11,1.0
925,525000.0,"Leadale Avenue, London, E4",E4,3.0
926,585000.0,"Parade Gardens, Chingford, E4",E4,4.0
927,415000.0,"Acacia Road, Leytonstone, London, E11",E11,3.0
928,735000.0,"Forest Rise, Walthamstow, London, E17",E17,3.0
933,375000.0,"High Street, London, E17",E17,1.0
934,595000.0,"Cazenove Road, Walthamstow, London. E17 4NP",E17,3.0
935,1100000.0,"West Avenue Road, Walthamstow, London, E17",E17,5.0
936,450000.0,"8 Thornbury Way, Waltamstow, E17",E17,2.0
938,325000.0,"Knotts Green Road, London, E10",E10,2.0
942,675000.0,"Glen Mews, Walthamstow, London, E17",E17,4.0
943,350000.0,"Salcombe Road, Walthamstow, E17",E17,2.0
946,450000.0,"Ruckholt Road, Leyton, E10",E10,2.0
948,349995.0,"Michael Road, London, E11",E11,2.0
949,300000.0,Chingford E4,E4,2.0
950,470000.0,"Skeltons Lane, Leyton, London, E10",E10,3.0
951,775000.0,"Colchester Road, Leyton, London, E10",E10,4.0
952,825000.0,"Higham Station Avenue, Highams Park, London, E4",E4,3.0
954,575000.0,"Kings Road, Chingford, E4",E4,4.0
955,535000.0,"Larkshall Crescent, Chingford, London. E4 6NS",E4,3.0
956,300000.0,"Greenleaf Road, London, E17",E17,1.0
959,185000.0,"Kingswood Court, Chingford, E4 8LL",E4,1.0
960,289995.0,"Seymour Court, Whitehall Road, North Chingford, London. E4 6DZ",E4,1.0
962,365000.0,"Newport Road, Leyton, London, E10",E10,2.0
965,350000.0,"Devonshire Road, Walthamstow, E17",E17,2.0
966,415000.0,"Sewardstone Gardens, Chingford, E4",E4,3.0
967,900000.0,"Colworth Road, London, E11",E11,5.0
968,650000.0,"Bedford Road, Walthamstow, London, E17",E17,4.0
969,675000.0,"Dunedin Road, E10, Leyton, London, E10",E10,4.0
971,375000.0,"Plot 1, 1 Joseph Ray Road, 647-661 High Road Leyt, Leytonstone, E11",E11,1.0
972,375000.0,"Plot 7, 647-661 High Road Leytonstone, Leytonstone, London, E11",E11,1.0
973,499000.0,"Plot 2, Joseph Ray Road, 647-661 High Road Leyt, Leytonstone, E11",E11,2.0
974,575000.0,"Westdown Road, London, E15",E15,3.0
978,480000.0,"Starley Rise, Motion, E10",E10,2.0
981,800000.0,"Fairlop Road, Leytonstone, London, E11",E11,4.0
982,700000.0,"Roland Road, Walthamstow, London, E17",E17,3.0
983,275000.0,"Manor Road, Leyton, E10",E10,1.0
984,535000.0,"High Street, London, E17",E17,2.0
985,310000.0,"Topaz Court, Leytonstone, London, E11 3GA",E11,1.0
988,550000.0,"Belton Road, Leytonstone, London, E11",E11,3.0
989,499000.0,"High Road Leytonstone, London, E11",E11,2.0
990,489000.0,"Plot 5, 647-661 High Road Leytonstone, Leytonstone, London, E11",E11,2.0
991,399000.0,"Plot 12, 647-661 High Road Leytonstone, Leytonstone, London, E11",E11,2.0
992,340000.0,"Panther House, Leytonstone, London, E11",E11,1.0
993,350000.0,"Plot 10, 647-661 High Road Leytonstone, Leytonstone, London, E11",E11,1.0
995,375000.0,"Markhouse Road, London, E17 ",E17,2.0
996,498000.0,"High Road Leytonstone, London, E11",E11,2.0
997,389000.0,"High Road Leytonstone, London, E11",E11,2.0
998,775000.0,"Beech Hall Road, Highams Park, E4",E4,3.0
999,700000.0,"Coopers Lane, London, E10",E10,4.0
1001,650000.0,"Beresford Road, Chingford, E4",E4,3.0
1002,125000.0,"Lea Bridge Road, Leyton, E10",E10,0.0
1003,515000.0,"Thorpe Road, Forest Gate, London, E7",E7,2.0
1004,400000.0,"North Birkbeck Road, Leytonstone, London, E11",E11,2.0
1006,800000.0,"Westdown Road, Leyton, London, E15",E15,5.0
1007,299995.0,"Vicarage Road, Leyton, London, E10 5EA",E10,1.0
1008,625000.0,"Springfield Road, Walthamstow, London, E17",E17,4.0
1009,515000.0,"KINGSDOWN ROAD, LEYTONSTONE, E11 3LP",E11,3.0
1011,110000.0,"Hedgerow Court, East Ham, E6 2RL",E6,1.0
1012,650000.0,"Granvile Road, Walthamstow, London, E17",E17,2.0
1013,220000.0,"Liden Close, Walthamstow, London E17",E17,1.0
1014,700000.0,"Hale End Road, WOODFORD GREEN, IG8 9LL",IG8,4.0
1016,180000.0,"Chingford Lane, Woodford Green, Essex, IG8",IG8,1.0
1018,325000.0,"Serbin Close, London, E10",E10,2.0
1020,400000.0,"Warner Flat - Clementina Road, Leyton London E10 - Two Bedroom Warner Flat",E10,2.0
1022,575000.0,"Arundel Close, Forest Gate, London, E15",E15,4.0
1023,340000.0,"High Road Leytonstone, London, E11",E11,1.0
1024,365000.0,"High Road Leytonstone, London, E11",E11,1.0
1026,330000.0,"High Road Leytonstone, London, E11",E11,1.0
1027,479000.0,"High Road Leytonstone, London, E11",E11,2.0
1028,280000.0,"High Road Leytonstone, London, E11",E11,1.0
1029,330000.0,"High Road Leytonstone, London, E11",E11,1.0
1030,455000.0,"High Road Leytonstone, London, E11",E11,2.0
1031,178000.0,"Kingswood Court, Chingford, E4 8LL",E4,1.0
1032,325000.0,"Prospect Hill, London, E17",E17,2.0
1034,325000.0,"Buckland Road, Leyton, E10",E10,2.0
1036,179500.0,"Kingswood Court, Chingford, E4 8LL",E4,1.0
1037,525000.0,"Goldsmith Road, London, E17 ",E17,3.0
1040,350000.0,"Titley Close, Chingford, London, E4",E4,3.0
1041,750000.0,"Dunedin Road, London, E10",E10,4.0
1044,475000.0,"Plot 3, 1 Joseph Ray Road, 647-661 High Road Leyt, Leytonstone, E11",E11,2.0
1046,183000.0,"Kingswood Court, Chingford, E4 8LL",E4,1.0
1047,375000.0,"Brookscroft Road, London, E17",E17,2.0
1048,334500.0,"Plot 8, 647-661 High Road Leytonstone, Leytonstone, London, E11",E11,1.0
