,price,address,postcode,number_bedrooms
0,1500000,"Fanthorpe Street, Putney, SW15 ",SW15,4
1,550000,"Coteford Street, Tooting, SW17",SW17,2
3,439999,"BALHAM HILL, SW12",SW12,1
4,795000,"Langridge House, Ram Quarter, SW18",SW18,2
5,750000,"Elsynge Road, Wandsworth, London, SW18",SW18,2
7,525000,"Lanson Building, Chelsea Bridge Wharf, London, SW11",SW11,1
8,129000,"Byron Court, Tooting, London, SW17",SW17,2
10,799950,"83-89 Upper Richmond Road, 
London, 
SW15 2FU",SW15,2
11,825000,"Burnelli Building, Chelsea Bridge Wharf, London, SW11",SW11,2
12,730000,"Rossiter Road, SW12",SW12,2
13,519000,"Lancaster Mews, Wandsworth, SW18",SW18,2
14,600000,"Vantage Apartments, Putney, SW15",SW15,2
15,765000,"Fernside Road, SW12",SW12,2
16,700000,"Denning Mews, London, SW12",SW12,2
17,435000,"Henry Doulton Drive, London, SW17",SW17,2
20,849950,"83-89 Upper Richmond Road, 
London, 
SW15 2FU",SW15,2
22,1100000,"Simpson Street, Battersea, London, SW11",SW11,4
23,450000,"Wandsworth High Street, Wandsworth, London, SW18",SW18,3
26,1625000,"Manchuria Road, London, SW11",SW11,4
27,800000,"Holdernesse Road, London, SW17",SW17,3
28,650000,"Stapleton Road, London, SW17",SW17,3
30,550000,"Byton Road, London, SW17",SW17,2
31,525000,"Ludo Building, 375 Earlsfield Road, London, SW18",SW18,2
32,850000,"Salvin Road, Putney, SW15 ",SW15,4
33,900000,"Mossbury Road, London, SW11",SW11,3
34,3250000,"Montevetro, Battersea Church Road, SW11 3YJ",SW11,2
35,315000,"Warwick Building, Chelsea Bridge Wharf, London, SW11",SW11,0
36,615000,"Lanson Building, Chelsea Bridge Wharf, London, SW11",SW11,1
37,800000,"Eustace Building, Chelsea Bridge Wharf, London., SW11",SW11,2
38,725000,"Stormont Road, London, SW11",SW11,2
39,650000,"Elsenham Street, SW18",SW18,2
40,600000,"Wimbledon Park Side, Wimbledon, SW19",SW19,2
42,675000,"West Hill, Putney, SW15",SW15,2
44,825000,"Burnelli Building, Chelsea Bridge Wharf, 352 Queenstown Road, London, SW11",SW11,2
45,539950,"Prince Albert Mews, London, SW11",SW11,1
46,570000,"Grant Road, London, SW11",SW11,1
47,580000,"Grant Road, London, SW11",SW11,1
48,699000,"98 York Road, 
Battersea, 
SW11",SW11,2
51,350000,"Kingham Close, London, SW18 ",SW18,1
52,790000,"Willow Lodge, Cedars Road, SW4",SW4,2
54,1300000,"Thorney Crescent, London, SW11",SW11,3
55,620000,"Bridges Court Road, Battersea, London, SW11",SW11,2
56,1000000,"Bramcote Road, Putney, London, SW15",SW15,2
57,725000,"Mallinson Road, London, SW11",SW11,2
58,315000,"ALFREDA STREET, SW11",SW11,1
59,425000,"HUGUENOT TERRACE, SW18",SW18,1
60,1050000,"Putney Bridge Road, SW15",SW15,3
61,950000,"Eversleigh Road, London, SW11",SW11,3
62,950000,"Lower Richmond Road, Putney, London, SW15",SW15,4
64,520000,"Rosenau Road, SW11",SW11,1
65,575000,"Lavender Hill, London, SW11",SW11,2
66,600000,"Westleigh Avenue, Putney, SW15",SW15,2
67,1295000,"Dungarvan Avenue, Putney, London, SW15",SW15,4
68,800000,"Lavender Sweep, Battersea, SW11",SW11,3
72,550000,"Massingberd Way, London, SW17",SW17,2
73,625000,"Harvard House, Putney, SW15 ",SW15,2
74,400000,"Caistor House, Caistor Road, SW12",SW12,1
75,455000,"Beaumont Road, London, SW19",SW19,1
77,700000,"Westwood House, Old Devonshire Road, Balham, London, SW12",SW12,2
79,1500000,"Battersea Park Road, London, SW11",SW11,6
81,750000,"Alston Road, London, SW17",SW17,3
82,1100000,"Dinsmore Road, London, SW12",SW12,5
84,350000,Fayland Avenue London SW16,SW16,2
85,350000,"Harwood Court, Upper Richmond Road, London, SW15",SW15,1
86,3425000,"Clapham Common North Side, London, SW4",SW4,6
87,325000,"Siward Road, Earlsfield, London, SW17",SW17,1
89,1425000,"Cicada Road, London SW18",SW18,5
91,800000,"Eustace Building, Chelsea Bridge Wharf, 372 Queenstown Road, London, SW11",SW11,2
92,525000,"Khartoum Road, London, SW17",SW17,2
94,1180000,"Mascotte Road, London, SW15",SW15,4
95,775000,"Fountain Road, London SW17",SW17,4
99,255000,"Medfield Street, Roehampton, SW15",SW15,1
103,875000,"Balham Park Road, London, SW12",SW12,2
106,900000,"Wildcroft Manor, Wildcroft Road, London, SW15",SW15,4
109,227500,"Whitman Court, Earlsfield, Wandsworth, SW17",SW17,1
113,160000,"Chadwick House, 1 Latchmere Street, London, SW11 5JR",SW11,2
114,500000,"Charles Court , Putney, SW15",SW15,2
115,425000,"Blackshaw Road, Tooting, Tooting, SW17",SW17,2
116,325000,"Gilbey Road, Tooting, Tooting, SW17",SW17,1
117,500000,"Trafalgar House, Battersea Reach, Juniper Drive, Wandsworth, SW18",SW18,1
118,1335000,"Beech Close, Putney, London, SW15",SW15,3
119,450000,"Queenstown Road, SW8",SW8,2
120,1550000,"Broomwood Road, London, SW11",SW11,5
121,360000,"Wayford Street, Battersea, London, SW11",SW11,1
122,1175000,"Bemish Road, SW15",SW15,3
124,700000,"Haldon Road, Putney, London, SW18",SW18,2
127,1200000,"Balham Grove, Nightingale Triangle, London, SW12",SW12,4
128,1960000,"Rodway Road, London, SW15",SW15,5
133,750000,"Kenlor Road, Tooting, SW17",SW17,3
138,560000,"Louisville Road, London SW17",SW17,2
141,650000,"Earlsfield House, Swaffield Road, SW18, ",SW18,2
143,560000,"Primrose Mansions, Prince Of Wales Drive, Battersea, London, SW11",SW11,1
144,1225000,"Brocklebank Road, Wandsworth, London, SW18",SW18,4
145,450000,"Battersea Park Road, Battersea, SW11",SW11,2
147,465000,"Marcus Street, Wandsworth, SW18",SW18,2
148,1525000,"Nottingham Road, London SW17",SW17,4
150,837000,Lexington Gardens London SW8,SW8,2
151,1075000,"Southfields Road, Wandsworth, London, SW18",SW18,2
152,450000,"Kingswater Place, London, SW11",SW11,1
155,500000,"Aldrington Road, London, SW16",SW16,3
156,500000,"Rowena Crescent, Battersea, London, SW11",SW11,1
157,1250000,"Whistlers Avenue, Battersea, London, SW11",SW11,3
158,530000,"Renmuir Street, London, SW17",SW17,2
159,717000,"The Skyline Collection, Osiers Square, SW18",SW18,2
160,445000,"Lisle Close, Tooting Bec, SW17",SW17,2
161,639950,"Osiers Point, Wandsworth, SW18",SW18,2
162,600000,"St. Benets Close, London, SW17",SW17,2
163,480000,"West Hill, SW15",SW15,1
164,799995,"The Tramyard, Balham, London, SW17",SW17,2
165,839995,"The Tramyard, Balham, London, SW17",SW17,2
166,849995,"The Tramyard, Balham, London, SW17",SW17,3
167,864995,"The Tramyard, Balham, London, SW17",SW17,3
168,625000,"Queenstown Road, Battersea, London, SW8",SW8,2
169,895000,"Falcon Wharf, 34 Lombard Road, London, SW11",SW11,2
170,460000,"Albert Drive, London, SW19",SW19,3
173,425000,"Cargill Road, Wandsworth, London, SW18",SW18,2
174,500000,"Hardwicks Square, Wandsworth, SW18",SW18,2
175,774995,"Balham High Road,
London,
SW17 7FD",SW17,2
176,485000,"Vanderbilt Road, London, SW18",SW18,1
177,825000,"Grandison Road, SW11",SW11,2
178,600000,"Spencer Walk, Putney, SW15",SW15,1
179,550000,"56 Thrale Road, Streatham, SW16",SW16,2
180,374950,"Binstead House, Vermont Road, London, SW18",SW18,2
181,325000,"Littlecombe Close, Kersfield Road, London, SW15",SW15,1
183,375000,"Hayward Gardens, Putney, SW15",SW15,2
184,965000,"Laitwood, Balham, SW12",SW12,2
185,300000,"Park South, Austin Road, London, SW11",SW11,1
186,450000,"Eardley Road, London, SW16",SW16,2
189,2250000,"Gorst Road, London, SW11",SW11,5
190,549950,"West Hill Road, London, SW18",SW18,2
191,800000,"Lavender Sweep, London, SW11",SW11,2
194,375000,"Bedford Hill, SW12",SW12,1
195,725000,"Ambassador Building, Embassy Gardens, Nine Elms Lane, SW11",SW11,1
196,475000,"Byrne Road, London, SW12",SW12,1
200,900000,"Winsham Grove, London, SW11",SW11,2
207,625000,"George View House, 36 Knaresborough Drive, London, SW18",SW18,2
209,450000,"Maysoule Road, Battersea, London, SW11",SW11,3
210,385000,"Claudia Place, LONDON, SW19",SW19,2
213,315000,"Shelburne Court, 3 Carlton Drive, Putney, SW15 ",SW15,0
215,545000,"Renmuir Street, London, SW17",SW17,3
219,485000,"Gwynne Road, Battersea, London, SW11 ",SW11,1
220,450000,"Trade Tower, Coral Row, London, SW11",SW11,1
222,700000,"Juniper Drive, Battersea, SW18",SW18,2
223,775000,"Glenalmond House, Manor Fields, London, SW15",SW15,2
224,385000,"Lambeth Court, Frogmore, London, SW18",SW18,1
231,775000,"Upper Richmond Road, London, SW15",SW15,2
233,375000,"15-21 East Hill, Battersea, SW18",SW18,1
234,1750000,"Crestway, London, SW15",SW15,5
235,675000,"Broomwood Road, London, SW11",SW11,2
240,500000,"Roebuck House, London, SW15",SW15,2
241,475000,"Vanderbilt Road, London, SW18",SW18,1
242,675000,"Elspeth Road, Battersea, London, SW11",SW11,2
243,700000,"Battersea Rise, Battersea, London, SW11",SW11,2
244,850000,"Ambassador Building, Embassy Gardens, London, SW11",SW11,2
245,830000,"Nimrod Road, London, SW16",SW16,3
249,650000,"Battersea Park Road, SW11",SW11,2
250,707000,"Osiers Road,
London,
SW18 1NR",SW18,3
252,635000,"Felsham Road, Putney, SW15",SW15,2
253,899950,"Cromford Road, Putney, London, SW18",SW18,2
254,435000,"Barmouth Court, Barmouth Road, SW18",SW18,1
255,1650000,"Brodrick Road, Wandsworth, London, SW17",SW17,3
256,599950,"Cambridge Road, London, SW11",SW11,2
257,1850000,"Bridge Lane, London, SW11",SW11,3
260,649950,"Primrose Mansions, Prince Of Wales Drive, Battersea, London, SW11",SW11,1
261,2150000,"Brodrick Road, Wandsworth Common, Wandsworth, London, SW17",SW17,5
262,1225000,"Embassy Gardens, Ponton Road, Nine Elms, Vauxhall, London, SW8",SW8,2
263,1635000,"Embassy Gardens, Ponton Road, Nine Elms, Vauxhall, London, SW8",SW8,2
264,500000,"Lavender Gardens, Battersea, SW11",SW11,1
267,1650000,"Boundaries Road, Wandsworth, London, SW12.",SW12,5
270,675000,"Falcon Road, London, SW11",SW11,3
274,675000,"Eastfields Avenue, Wandsworth, London, SW18",SW18,2
275,465000,"Wingfield Court, Beaumont Road, SW19",SW19,1
277,675000,"Compass House, Smugglers Way, London, SW18",SW18,2
278,400000,"Beacon Tower, 1, Spectrum Way, London, SW18",SW18,1
281,510000,"Anchor House, Smugglers Way, Wandsworth, London, SW18",SW18,2
282,275000,"Edwyn House, 5 Neville Gill Close, London, SW18",SW18,3
283,850000,"Cornford Grove, London, SW12",SW12,2
284,595000,"Bickley Street, Tooting, London, SW17",SW17,2
285,700000,"Ribblesdale Road, Furzedown, Furzedown, London, SW16",SW16,4
287,550000,"Lombard Road, Battersea Square, London, SW11",SW11,1
288,1100000,"Falcon Wharf, Battersea, London, SW11",SW11,2
289,615000,"Manfred Court, Manfred Road, London, SW15",SW15,2
290,995000,"Zulu Mews, Battersea, London, SW11",SW11,2
291,475000,"Petworth Street, Battersea, London, SW11",SW11,1
292,375000,"St. Ann's Hill, London, SW18",SW18,2
295,1040000,"Longfield Street, SW18",SW18,4
296,850000,"Kingsley Street, London, SW11",SW11,2
297,5000000,"Henderson Road, London, SW18",SW18,6
298,699999,"LAVENDER HILL, SW11",SW11,2
300,400000,"Viewfield Road, SW18",SW18,1
302,1595000,"Cheriton Square, London SW17",SW17,4
307,1350000,"Grandison Road, Battersea, London, SW11",SW11,4
308,625000,"Cavendish Road, Balham, London, SW12",SW12,2
309,749500,"Galveston Road, SW15",SW15,3
312,525000,"Ramsden Road, London, SW12",SW12,2
313,1050000,"Aston Terrace, Clapham South, London, SW12",SW12,4
314,2300000,"Disraeli Road, London, SW15",SW15,5
315,1625000,"Mayford Road, London SW12",SW12,6
318,340000,"Dresden House, Dagnall Street, Battersea, London, SW11",SW11,2
319,550000,"College Gardens, London, SW17",SW17,2
320,425000,"Alexander Court, Wandsworth Common West Side, Wandsworth, London, SW18",SW18,3
325,800000,"Westleigh Avenue,, Putney, SW15",SW15,2
326,785000,"Upper Richmond Road, East Putney, London, SW15",SW15,3
327,1150000,"Lower Richmond Road, West Putney, London, SW15",SW15,1
329,400000,"Strathville Road, Earlsfield, London, SW18",SW18,1
332,425000,"George Court, Norstead Place, London, SW15",SW15,2
333,2895000,"Lavender Gardens, London, SW11",SW11,6
334,1250000,"Stafford Mansions, Albert Bridge Road, London, SW11",SW11,2
335,550000,"Franciscan Road, London, SW17",SW17,2
336,300000,"Eardley Road, London, SW16",SW16,1
337,665000,"Old York Road, London, SW18",SW18,2
342,900000,"Wagtail Court, 34 Pipit Drive, London, SW15",SW15,3
343,325000,"Stevenson House, 28 Latchmere Road, London, SW11",SW11,1
344,650000,"Southlands Drive, London, SW19",SW19,2
345,650000,"Putney Hill, Putney, London, SW15",SW15,2
346,775000,"Clapham Common North Side, London, SW4",SW4,2
348,3500000,"Albion Riverside Building, 8 Hester Road, Battersea Park, London, SW11",SW11,3
350,725000,"Albemarle, Wimbledon Park Side, Wimbledon, London, SW19",SW19,3
351,850000,"Drapers Yard, London, SW18",SW18,2
352,735000,"Fontarabia Road, London, SW11",SW11,2
354,929500,"Carlton Drive, London, SW15",SW15,3
355,650000,"Cowick Road, Tooting Bec, London, SW17",SW17,3
357,475000,"Balham Hill, Balham, London, SW12",SW12,1
358,550000,"Ravensbury Terrace, Earlsfield, SW18",SW18,1
359,875000,"Gosberton Road, London SW12",SW12,2
360,600000,"Bennerley Road, London, SW11",SW11,2
362,2895000,"Manville Road, London, SW17",SW17,7
363,590000,"Upper Richmond Road, SW15",SW15,3
364,500000,"Roma Court, London SW12",SW12,2
366,360000,"Watford Close, Battesea, London, SW11",SW11,2
367,900000,"Winsham Grove, London, SW11",SW11,2
368,700000,"Battersea Rise, London, SW11",SW11,3
369,1100000,"Harbut Road, Battersea, London, SW11",SW11,4
370,450000,"Battersea Rise, Battersea, London, SW11",SW11,1
374,520000,"Ribblesdale Road, Tooting, SW16",SW16,3
375,2600000,"Thurleigh Road, London, SW12",SW12,5
376,875000,"Schubert Road,Putney,SW15",SW15,3
378,415000,"Sutherland Grove, Southfields, London, SW18",SW18,1
379,565000,"Bickley Street, London, SW17",SW17,2
381,569000,"98 York Road, 
Battersea, 
SW11",SW11,1
382,1275000,"Glycena Road, Battersea, London, SW11",SW11,4
383,950000,"Elm Quay Court, 30 Nine Elms Lane, Vauxhall, London, SW8",SW8,2
384,460000,"Maysoule Road, Battersea, SW11",SW11,3
385,785000,"Brewhouse Lane, Putney, London, SW15",SW15,2
386,800000,"Westleigh Avenue,, Putney, SW15",SW15,2
387,850000,"Upper Richmond Road, Putney, London, SW15",SW15,2
388,775000,"Allfarthing Lane, Wandsworth, London, SW18",SW18,3
389,499950,"Nightingale Lane, Nightingale Triangle, London, SW12",SW12,1
390,1075000,"Albany Mansions, Albert Bridge Road, London, SW11",SW11,3
391,1150000,"Prince Of Wales Drive, SW11",SW11,3
394,1850000,"Ursula Street, SW11",SW11,4
395,600000,"Derinton Road, London, SW17",SW17,2
396,600000,"Boutflower Road, London, SW11",SW11,1
397,275000,"Sparkford House, Battersea Church Road, Battersea, London, SW11",SW11,1
400,875000,"Edgel Street, The Tonsleys, London, SW18",SW18,1
403,2950000,"Dealtry Road, London, SW15",SW15,6
404,795000,"Moffat Road, London, SW17",SW17,3
405,1500000,"Crieff Road, Wandsworth, London, SW18",SW18,4
406,1795000,"Lightermans Walk, Prospect Quay, Wandsworth, London, SW18",SW18,4
410,1750000,"Manchuria Road, London, SW11",SW11,5
411,625000,"Ramsden Road, London, SW12",SW12,2
413,400000,"Carter House, Petergate, SW11",SW11,1
416,1050000,"Selkirk Road, London, SW17",SW17,4
418,495000,"Bevill Allen Close, Tooting, London, SW17",SW17,3
422,399000,"Latchmere Road, Battersea, London, SW11",SW11,1
425,500000,"Carter House, 33 Petergate, London, SW11",SW11,2
430,695000,"Elspeth Road, London, SW11",SW11,2
431,465000,"Dalebury Road, London, SW17",SW17,1
432,335000,"Earlsfield Road, London, SW18",SW18,1
434,635000,"Balham High Road, London, SW12",SW12,2
441,184000,"Trevelyan Road, Wandsworth, London, SW17",SW17,1
442,750000,"Acris Street, London, SW18",SW18,2
448,1250000,"Cathles Road, London, SW12",SW12,5
449,535000,"Southfields Court, Augustus Road, London, SW19",SW19,2
450,649950,"Battersea Park Road, Battersea, SW11",SW11,2
451,975000,"Orchard Mews, Franche Court Road, London, SW17",SW17,4
453,850000,"Sesame Apartments, SW11",SW11,3
454,700000,"Sesame Apartments, SW11",SW11,2
456,585000,"Sesame Apartments, SW11",SW11,1
458,950000,"Ribblesdale Road, London, SW16",SW16,4
459,2000000,"Old Garden House, Bridge Lane, Battersea, London, SW11",SW11,4
460,450000,"Battersea Rise, SW11",SW11,1
461,575000,"Alderbrook Road, London, SW12",SW12,3
462,925000,"St. James's Drive, London, SW17",SW17,3
464,1650000,"Alderbrook Road, London, SW12",SW12,5
465,750000,"Acris Street, London, SW18",SW18,2
466,1700000,"Bennerley Road, London, SW11",SW11,4
467,875000,"Balham New Road, Balham, SW12",SW12,3
468,1300000,"Erpingham Road, SW15",SW15,3
469,620000,"Wagtail Court Pipit Drive, Putney, SW15",SW15,2
472,485000,"Tooting High Street, London, SW17",SW17,2
473,700000,"Ambassador Building, Embassy Gardens, Nine Elms, SW11",SW11,1
474,539950,"Sefton Street, London, SW15",SW15,2
475,545000,"Renmuir Street, London, SW17",SW17,3
476,595000,"Sefton Street, Putney, SW15",SW15,2
478,480000,"Eastfields Avenue, Wandsworth Town, London, SW18",SW18,1
479,650000,"Kendal Place, Putney, London, SW15",SW15,2
480,1100000,"Abercrombie Street, London, SW11",SW11,3
481,1800000,"Octavia Street, Battersea, London, SW11",SW11,4
482,380000,"Brady House, Queenstown, SW8",SW8,3
483,485000,"183 Tooting High Street, Tooting, SW17",SW17,2
486,485000,"Spanish Road, Battersea,London, SW18",SW18,2
488,500000,"Marcus Street, SW18",SW18,1
490,250000,"Rectory Lane, London SW17",SW17,0
491,524950,"Oyster Wharf, Lombard Road, SW11",SW11,2
498,780000,"Standen Road, SW18",SW18,2
500,2850000,"Dents Road, London SW11",SW11,5
501,380000,"Fouracres, Little Dimocks, SW12",SW12,1
502,975000,"Mayford Road, London, SW12",SW12,2
504,1150000,"Ballantine Street, Wandsworth, SW18",SW18,3
505,575000,"Oakhill Road, Putney, SW15",SW15,3
506,1285000,"Tonsley Hill, Wandsworth, SW18",SW18,4
508,435000,"Garton Place, Wandsworth, London, SW18",SW18,2
511,1600000,"Althorp Road, London SW17",SW17,4
512,1200000,"Hosack Road, London, SW17",SW17,3
513,530000,"Coral Row, SW11",SW11,1
514,400000,"Battersea Rise, Battersea, London, SW11",SW11,0
515,450000,"Tooting High Street, Tooting, Tooting, SW17",SW17,2
517,650000,"Cobalt Place, Battersea, London, SW11",SW11,2
518,450000,"Heron House, Searles Close, Battersea, London, SW11",SW11,3
519,695000,"Coopers' Lofts, Ram Quarter, SW18",SW18,1
520,585000,"Earlsfield Road, Wandsworth, SW18",SW18,2
521,1100000,"Thurleigh Avenue, London, SW12",SW12,2
523,950000,"Tiffany Heights, 59 Standen Road, London, SW18",SW18,3
525,900000,"Winsham Grove, London, SW11",SW11,2
528,485000,"230 Roehampton Lane, Roehampton, SW15",SW15,2
531,1200000,"Harberson Road, London SW12",SW12,4
532,580000,"St. Ann's Crescent, Wandsworth, London, SW18",SW18,2
533,590000,"Trott Street, Battersea, London, SW11",SW11,3
534,685000,"Battersea Reach, Wandsworth Town, London, SW18",SW18,2
535,700000,"St Johns Hill, Clapham Junction, London, SW11",SW11,2
536,900000,"Standen Road, SW18",SW18,2
537,265000,"7 Bramlands Close, Clapham, SW11",SW11,1
539,2600000,"Honeywell Road, London, SW11",SW11,5
540,700000,"Inner Park Road, London, SW19",SW19,3
541,550000,"Prince Of Wales Mansions, Prince Of Wales Drive, London, SW11",SW11,1
542,475000,"Selhurst Close, London, SW19",SW19,2
543,595000,"Sefton Street, Putney, London, SW15",SW15,2
546,679950,"Haldon Road, London, SW18",SW18,2
547,1700000,"Drury Close, London, SW15",SW15,5
548,525000,"Riverlight Quay, London, SW11",SW11,1
550,818000,Lexington Gardens London SW11,SW11,2
552,399950,"Olney House, Wynter Street, Battersea, London, SW11",SW11,1
553,695000,"Harbut Road, battersea, SW11",SW11,2
554,2350000,"Brynmaer Road, Battersea, London, SW11",SW11,5
571,590000,"Vitali Close, London, SW15",SW15,2
572,700000,"Nightingale Lane, London, SW12",SW12,2
573,2100000,"Broomwood Road, London SW11",SW11,5
574,690000,"Buckhold Road, Wandsworth, London, SW18",SW18,2
575,700000,"St Johns Hill, Clapham Junction, London, SW11",SW11,2
576,607500,"Eltringham Street, Wandsworth, SW18",SW18,2
577,1299999,"Queenstown Road, Chelsea Bridge Wharf, SW11",SW11,2
578,1150000,"Kingslawn Close, Putney, London, SW15",SW15,5
580,675000,"Waterbank House, 34 Knaresborough Drive, London, SW18",SW18,2
581,695000,"Althorp House, 4-6 Althorp Road, London, SW17",SW17,2
584,1225000,"Sefton Street, Putney, London, SW15",SW15,3
585,375000,"Gwendolen Avenue, Putney, London, SW15",SW15,1
586,700000,"Ambassador Building, Embassy Gardens, London, SW11",SW11,1
587,1200000,"Wadham Road, Putney, London, SW15",SW15,4
588,800000,"Upper Richmond Road, SW15",SW15,2
589,1150000,"Stafford Mansions, Albert Bridge Road, London, SW11",SW11,2
592,760000,"Kirtling Street, London, SW8",SW8,0
594,280000,"Coleman Court, Kimber Road, Wandsworth, London, SW18",SW18,1
595,750000,"Dray House, 8 Bellwether Lane, Wandsworth, SW18",SW18,2
596,774950,"Highlands Heath, Putney, London, SW15",SW15,4
597,590000,"Letchworth Street, London, SW17",SW17,3
598,1195000,"Riverside Court, Nine Elms Lane, London, SW8",SW8,3
599,1450000,"St James's Drive, London, SW17",SW17,5
600,1075000,"Southfields Road, Wandsworth, London, SW18",SW18,2
601,595000,"Sefton Street, Putney, London, SW15",SW15,2
602,595000,"Sefton Street, Putney, London, SW15",SW15,2
603,325000,"Wolftencroft Close, Battersea, London, SW11",SW11,1
604,539950,"Sefton Street, Putney, London, SW15",SW15,2
606,695000,"Witham House, Enterprise Way, SW18",SW18,2
608,1050000,"Strathville Road, London, SW18",SW18,4
610,1375000,"Gartmoor Gardens, London, SW19",SW19,4
612,525000,"Albert Bridge Road, Battersea Park, London, SW11",SW11,1
614,469950,"Denton Street, Wandsworth, SW18",SW18,2
615,879950,"Oak Park Gardens, Wimbledon, SW19 6AR",SW19,3
616,2400000,"3 Riverlight Quay, Nine Elms, SW11",SW11,3
619,1250000,"Lombard Wharf, London, SW11",SW11,2
620,425000,"SOUTHOLM STREET, SW11",SW11,1
622,500000,"Winders Road, London, SW11",SW11,4
625,692000,"Osiers Square, Wandsworth, SW18",SW18,3
628,3200000,"Heath House, London, SW15",SW15,5
629,620000,"Three Riverlight Quay, Nine Elms Lane, SW11",SW11,1
631,550000,"Castle Court, Brewhouse Lane, SW15",SW15,2
632,925000,"Pipit Drive, Putney, London, SW15",SW15,3
636,375000,"George Court, Norstead Place, London, SW15",SW15,2
637,455000,"Beaumont Road, London, SW19",SW19,1
638,725000,"Beaumont Road, London, SW19",SW19,3
639,600000,"Beaumont Road, London, SW19",SW19,2
640,600000,"Beaumont Road, London, SW19",SW19,2
641,595000,"104 Wandsworth High Street, Clapham, SW18",SW18,2
642,500000,"Copperlight Apartments, Wandsworth,London, SW18",SW18,1
649,750000,"Valiant House, Vicarage Crescent, London, SW11",SW11,2
650,625000,"Cavendish Road, Balham, London, SW12",SW12,2
651,1200000,"Lurline Gardens, London, SW11",SW11,3
652,1025000,"Selkirk Road, London, SW17",SW17,5
653,475000,"Salterford Road, London, SW17",SW17,2
654,550000,"Phoenix Way, Wandsworth Town, SW18",SW18,2
655,575000,"Crimsworth Road, London, SW8",SW8,2
657,799950,"Eastfields Avenue, Putney, London, SW18",SW18,3
660,785000,"Felsham Road, London, SW15",SW15,2
661,400000,"Viewfield Road, SW18",SW18,1
662,499950,"Altura Tower, Bridges Court Road, Battersea, SW11",SW11,1
667,825000,"Bellevue Road, London, SW17",SW17,2
668,760000,"Beauchamp Road, London, SW11",SW11,2
669,725000,"Lavender Hill, London, SW11",SW11,2
670,1300000,"Blandfield Road, London, SW12",SW12,4
675,2600000,"Thurleigh Road, London, SW12",SW12,5
678,950000,"Khama Road, London, SW17",SW17,4
679,600000,"Pipit Drive, Putney, London, SW15",SW15,2
680,850000,"Wells Place, London, Wandsworth, SW18",SW18,3
682,350000,"West Drive, London, London, SW16",SW16,2
683,950000,"Broomwood Road, Battersea, SW11",SW11,3
686,1250000,"Buckmaster Road, London, SW11 ",SW11,4
689,50000,"Kimber Road, Southfields, London, SW18",SW18,1
690,2850000,"St. James's Drive, London, SW17",SW17,6
691,975000,"Algarve Road, London, SW18",SW18,3
692,1450000,"Wakehurst Road, London, SW11",SW11,4
694,1825000,"York Mansions, Prince Of Wales Drive, London, SW11",SW11,3
697,350000,"Little Dimocks, Balham, SW12",SW12,1
698,2950000,"Parkfields, London, SW15",SW15,5
699,1575000,"Broomwood Road, London, SW11",SW11,5
700,875000,"Edgel Street, The Tonsleys, London, SW18",SW18,1
707,690000,"Cranmer Terrace, Tooting, Tooting, SW17",SW17,3
708,1000000,"Wix's Lane, London, SW4",SW4,3
710,925000,"Felsham Road, Putney, SW15 ",SW15,4
711,650000,"Altura Tower, Battersea, London, SW11",SW11,2
712,500000,"Derinton Road, London SW17",SW17,2
713,375000,Du Cane Court Balham High Road Balham SW17 7JE,SW17,1
715,475000,"Gilbey Road, Tooting, Tooting, SW17",SW17,2
716,250000,"Cortis Road, Putney, SW15",SW15,1
717,685000,"Calico House, Clove Hitch Quay, Plantation Wharf, Battersea, SW11",SW11,1
721,449950,"Beacon Tower, The Filaments, Wandsworth, London, SW18",SW18,1
722,350000,"Battersea Park Road, Battersea, London, SW11 ",SW11,1
724,815000,"Selkirk Road, London, SW17",SW17,3
725,950000,"Capital Building, Embassy Gardens, Nine Elms, SW11",SW11,2
727,700000,"Corsehill Street, London, SW16",SW16,3
728,535000,"Cologne Road, London, SW11",SW11,2
729,818000,"Ponton Road,
Vauxhall,
London,
SW8",SW8,2
730,650000,"Stapleton Road, London, SW17",SW17,2
731,675000,"Juniper Drive, Battersea, SW18",SW18,2
732,695000,"Old York Road, London, SW18",SW18,3
733,550000,"Broadway Lofts, 10 Gatton Road, London, SW17",SW17,2
734,545000,"Loubet Street, London, SW17",SW17,2
735,1899950,"Glenburnie Road, Tooting, SW17",SW17,5
736,465000,"West Hill, Putney, London, SW18",SW18,1
737,949950,"Bader Way, London, SW15",SW15,4
739,799950,"Latchmere Road, London, SW11",SW11,4
740,825000,"Clapham Common North Side, London, SW4.",SW4,3
741,529950,"Thurleigh Road, Wandsworth Common, London, SW12",SW12,1
743,2625000,"Clapham Common West Side, London, SW4",SW4,6
745,649995,"The Tramyard, Balham, London, SW17",SW17,2
746,669995,"The Tramyard, Balham, London, SW17",SW17,2
747,679995,"The Tramyard, Balham, London, SW17",SW17,2
748,684995,"The Tramyard, Balham, London, SW17",SW17,2
749,689995,"The Tramyard, Balham, London, SW17",SW17,2
751,689995,"The Tramyard, Balham, London, SW17",SW17,2
752,734995,"The Tramyard, Balham, London, SW17",SW17,2
753,774995,"The Tramyard, Balham, London, SW17",SW17,2
754,969995,"The Tramyard, Balham, London, SW17",SW17,3
756,2800000,"Trinity Road, Wandsworth, London, SW17",SW17,6
757,925000,"Albert Bridge Road, London, SW11",SW11,1
758,1000000,"Millennium House, 10 Plaza Gardens, London, SW15",SW15,2
759,1100000,"Kenilworth Court, Lower Richmond Road, London, SW15",SW15,4
760,600000,"Beeches Road, London SW17",SW17,3
761,1700000,"Manchuria Road, SW11",SW11,4
